,id_ficha,fecha_entrada,tipo,titulo,origen,presentado_por
0,133188,2016-12-14,RESOLUCION,"AGAZZI, Ernesto. SENADOR REPUBLICA. RENUNCIA.",Cámara Senadores  ,"Agazzi, Ernesto"
1,132804,2016-11-22,PROYECTO DE LEY,ENTES AUTÓNOMOS. SERVICIOS DESCENTRALIZADOS. GIRO. MODIFICACIÓN.,Cámara Senadores  ,"Agazzi, Ernesto; Ayala, Patricia; Berterreche, Andrés; Carámbula Volpi, Marcos Gustavo; De León, Leonardo; Martínez Huelmo, Rubén; Michelini, Rafael; Moreira, Constanza; Otheguy Vega, Marcos Javier; Pardiñas, Yeru; Passada, Ivonne; Payssé, Daniela; Pintado, Enrique; Topolansky, Lucía; Xavier, Mónica"
2,132477,2016-11-01,DECLARACION,REPÚBLICA ITALIANA. TERREMOTOS. SOLIDARIDAD. MANIFESTACIONES.,Cámara Senadores  ,"Agazzi, Ernesto; Amorín, José; Delgado, Alvaro; Heber, Luis Alberto; Mieres, Pablo"
3,132117,2016-10-18,LEY,INGENIERO RICARDO ROSA. TRAMO RUTA 67 (DESDE ELIAS REGULES HASTA SAUCE). DENOMINACION.,Cámara Senadores  ,"Agazzi, Ernesto; Ayala, Patricia; Carámbula Volpi, Marcos Gustavo; De León, Leonardo; Ferreira, Zulimar; Lazo, Sandra; Martínez Huelmo, Rubén; Michelini, Rafael; Moreira, Constanza; Mujica, José; Otheguy Vega, Marcos Javier; Payssé, Daniela; Pintado, Enrique; Tourné, Daisy; Xavier, Mónica"
4,132114,2016-10-18,LEY,"TOSCANINI, JUAN. TRAMO RUTA 69 (DESDE INTERSECCION CON RUTAS 67 Y 68 HASTA INTERSECCION CON RUTA 32). DENOMINACION.",Cámara Senadores  ,"Agazzi, Ernesto; Ayala, Patricia; Carámbula Volpi, Marcos Gustavo; De León, Leonardo; Ferreira, Zulimar; Lazo, Sandra; Martínez Huelmo, Rubén; Michelini, Rafael; Moreira, Constanza; Mujica, José; Otheguy Vega, Marcos Javier; Payssé, Daniela; Pintado, Enrique; Tourné, Daisy; Xavier, Mónica"
5,132139,2016-10-14,PROYECTO DE RESOLUCION   ,CONVENCION NACIONAL TRABAJADORES (CNT).  50° ANIVERSARIO FUNDACION. CONMEMORACION. CONVOCATORIA.,Asamblea General  ,"Agazzi, Ernesto; Aristimuño, Saúl; Barreiro, Gabriela; Civila, Gonzalo; De los Santos, Oscar; Garin De Nardo, Daniel; Mahía, José Carlos; Michelini, Rafael; Mier, Sergio; Moreira, Constanza; Posada, Iván; Pozzi, Jorge; Reutor, Carlos; Sanseverino, Berta; Santalla, Mercedes; Tourné, Daisy; Viel, Stella"
6,131836,2016-09-27,PROYECTO DE RESOLUCION   ,"RODO, José Enrique. 100 AÑOS FALLECIMIENTO. HOMENAJES. COMISION ESPECIAL. CREACION.",Asamblea General  ,"Agazzi, Ernesto; Ayala, Patricia; Baráibar, Carlos; Berterreche, Andrés; Chiazzaro, Roberto; De León, Leonardo; Gelman, Macarena; Lazo, Sandra; Mahía, José Carlos; Moreira, Constanza; Passada, Ivonne; Pelegrín, Mariela; Querejeta, José; Sabini, Sebastián; Santalla, Mercedes"
7,131029,2016-08-03,LEY,PRODUCCION BASES AGROECOLOGICAS. INTERES GENERAL. DECLARACION. COMISION HONORARIA NACIONAL. CREACION.,Cámara Senadores  ,"Agazzi, Ernesto; Aristimuño, Saúl; Ayala, Patricia; Carámbula Volpi, Marcos Gustavo; De León, Leonardo; Martínez Huelmo, Rubén; Michelini, Rafael; Mujica, José; Passada, Ivonne; Payssé, Daniela; Pintado, Enrique; Topolansky, Lucía; Xavier, Mónica"
8,130766,2016-07-13,PROYECTO DE LEY,CODIGO CIVIL. MATRIMONIO. EDAD MÍNIMA. MODIFICACION.,Cámara Senadores  ,"Agazzi, Ernesto; Aristimuño, Saúl; Ayala, Patricia; De León, Leonardo; Gallicchio Queirolo, Antonio; Gomori Rettich, Eva Cristina; Lorier, Eduardo; Martínez Huelmo, Rubén; Mujica, José; Pardiñas, Yeru; Passada, Ivonne; Paternain Rodríguez, Rafael; Pintado, Enrique; Pintos Ruiz, Julio Miguel; Topolansky, Lucía"
9,130280,2016-06-15,PROYECTO DE LEY,"VILLALBA, Olegario. ESCUELA RURAL N° 97 VILLA SERRANA (LAVALLEJA). DENOMINACIÓN.",Cámara Senadores  ,"Agazzi, Ernesto; Ayala, Patricia; Baráibar, Carlos; Carámbula Volpi, Marcos Gustavo; De León, Leonardo; Lazo, Sandra; Martínez Huelmo, Rubén; Michelini, Rafael; Moreira, Constanza; Mujica, José; Otheguy Vega, Marcos Javier; Passada, Ivonne; Payssé, Daniela; Topolansky, Lucía; Tourné, Daisy; Xavier, Mónica"
10,129742,2016-05-18,PROYECTO DE RESOLUCION,REGLAMENTO CÁMARA SENADORES. DISPOSICIONES. MODIFICACIÓN.,Cámara Senadores  ,"Agazzi, Ernesto"
11,128594,2016-03-08,DECLARACION,"CÁCERES, Berta. ORGANIZACIONES POPULARES E INDÍGENAS HONDURAS. PRESIDENTA. ASESINATO. JUSTICIA. RECLAMO. DECLARACIÓN.",Cámara Senadores  ,"Agazzi, Ernesto; Alonso, Verónica; Aviaga Martínez, María Carol; Ayala, Patricia; Berterreche, Andrés; Bianchi, Daniel; Bordaberry Herrán, Juan Pedro; Camy Antognazza, Carlos Daniel; Coutinho Rodríguez, Germán; Delgado, Alvaro; García, Javier; Heber, Luis Alberto; Lacalle Pou, Luis Alberto; Lafluf, Omar; Larrañaga, Jorge; Martínez Huelmo, Rubén; Michelini, Rafael; Mieres, Pablo; Passada, Ivonne; Saravia, Jorge; Topolansky, Lucía"
12,128446,2016-03-02,LEY,MOSQUITO AEDES AEGYPTI. FUMIGACION PREDIOS BALDÍOS Y FINCAS ABANDONADAS. INGRESO. AUTORIZACIÓN.,Cámara Senadores  ,"Agazzi, Ernesto; Ayala, Patricia; Berterreche, Andrés; Carámbula Volpi, Marcos Gustavo; De León, Leonardo; Martínez Huelmo, Rubén; Michelini, Rafael; Moreira, Constanza; Otheguy Vega, Marcos Javier; Passada, Ivonne; Payssé, Daniela; Pintado, Enrique; Topolansky, Lucía; Tourné, Daisy"
13,128332,2016-02-16,RESOLUCION,EX LEGISLADORES ZELMAR MICHELINI Y HECTOR GUTIERREZ RUIZ. DISCURSOS PARLAMENTARIOS. RECOPILACION Y EDICION,Cámara Senadores  ,"Agazzi, Ernesto; Ayala, Patricia; Carámbula Volpi, Marcos Gustavo; De León, Leonardo; Martínez Huelmo, Rubén; Moreira, Constanza; Otheguy Vega, Marcos Javier; Passada, Ivonne; Payssé, Daniela; Topolansky, Lucía; Tourné, Daisy"
14,127268,2015-11-10,PROYECTO DE LEY,INSTITUCIÓN NACIONAL DERECHOS HUMANOS . CREACIÓN. MODIFICACIÓN.,Cámara Senadores  ,"Agazzi, Ernesto; Ayala, Patricia; Berterreche, Andrés; Carámbula Volpi, Marcos Gustavo; De León, Leonardo; Ferreira, Zulimar; Martínez Huelmo, Rubén; Meléndez, Lauro; Michelini, Rafael; Moreira, Constanza; Mujica, Gonzalo; Otheguy Vega, Marcos Javier; Payssé, Daniela; Pintado, Enrique; Tourné, Daisy; Xavier, Mónica"
15,125989,2015-08-12,RESOLUCION   ,ALIMENTACIÓN. DERECHO. COMISIÓN ESPECIAL. CREACIÓN.,Asamblea General  ,"Agazzi, Ernesto; Cardoso, José Carlos"
16,125462,2015-07-14,PROYECTO DE RESOLUCION   ,"SINGLET, Manuel. FALLECIMIENTO. HOMENAJE.",Cámara Senadores  ,"Agazzi, Ernesto; Alonso, Verónica; Camy Antognazza, Carlos Daniel; Coutinho Rodríguez, Germán; Delgado, Alvaro; Eguiluz, Cecilia; García, Javier; Lacalle Pou, Luis Alberto; Larrañaga, Jorge; Martínez Huelmo, Rubén; Mieres, Pablo; Montaner, Martha; Mujica, José; Topolansky, Lucía; Tourné, Daisy; Xavier, Mónica"
17,125290,2015-07-01,PROYECTO DE LEY,INMUEBLES RURALES. DERECHO PROPIEDAD. TITULARIDAD. MODIFICACIÓN.,Cámara Senadores  ,"Agazzi, Ernesto; Ayala, Patricia; Berterreche, Andrés; Carámbula Volpi, Marcos Gustavo; De León, Leonardo; Gallicchio Queirolo, Antonio; Lazo, Sandra; Martínez Huelmo, Rubén; Moreira, Constanza; Otheguy Vega, Marcos Javier; Pardiñas, Yeru; Passada, Ivonne; Payssé, Daniela; Pintado, Enrique; Topolansky, Lucía; Xavier, Mónica"
18,125289,2015-07-01,PROYECTO DE LEY,PEONES PRÁCTICOS Y OBREROS NO ESPECIALIZADOS. TRABAJO. MODIFICACIÓN.,Cámara Senadores  ,"Agazzi, Ernesto; Ayala, Patricia; Berterreche, Andrés; Carámbula Volpi, Marcos Gustavo; De León, Leonardo; Gallicchio Queirolo, Antonio; Lazo, Sandra; Martínez Huelmo, Rubén; Otheguy Vega, Marcos Javier; Pardiñas, Yeru; Passada, Ivonne; Payssé, Daniela; Pintado, Enrique; Topolansky, Lucía; Xavier, Mónica"
19,125291,2015-07-01,LEY,PUERTO JOSE CARBAJAL EL SABALERO. PUERTO SAUCE (COLONIA). DENOMINACION. MODIFICACION.,Cámara Senadores  ,"Agazzi, Ernesto; Ayala, Patricia; Berterreche, Andrés; Carámbula Volpi, Marcos Gustavo; De León, Leonardo; Gallicchio Queirolo, Antonio; Lazo, Sandra; Martínez Huelmo, Rubén; Moreira, Constanza; Otheguy Vega, Marcos Javier; Pardiñas, Yeru; Passada, Ivonne; Payssé, Daniela; Pintado, Enrique; Topolansky, Lucía; Xavier, Mónica"
20,125293,2015-07-01,PROYECTO DE LEY,ESPACIO COSTERO OCEANO ATLANTICO Y RIO DE LA PLATA. USO. REGULACION.,Cámara Senadores  ,"Agazzi, Ernesto; Ayala, Patricia; Berterreche, Andrés; Carámbula Volpi, Marcos Gustavo; De León, Leonardo; Gallicchio Queirolo, Antonio; Lazo, Sandra; Martínez Huelmo, Rubén; Otheguy Vega, Marcos Javier; Passada, Ivonne; Payssé, Daniela; Pintado, Enrique; Topolansky, Lucía; Xavier, Mónica"
21,125292,2015-07-01,PROYECTO DE LEY,OBRAS INTELECTUALES Y ARTÍSTICAS. REPRODUCCIÓN. REGULACIÓN.,Cámara Senadores  ,"Agazzi, Ernesto; Ayala, Patricia; Berterreche, Andrés; Carámbula Volpi, Marcos Gustavo; De León, Leonardo; Gallicchio Queirolo, Antonio; Lazo, Sandra; Martínez Huelmo, Rubén; Otheguy Vega, Marcos Javier; Pardiñas, Yeru; Passada, Ivonne; Payssé, Daniela; Pintado, Enrique; Topolansky, Lucía; Xavier, Mónica"
22,125014,2015-06-16,LEY,"FRUTAS, FLORES Y HORTALIZAS. IVA. FONDO RECONSTRUCCION Y FOMENTO DE LA GRANJA. FINANCIACION. PRORROGA.",Cámara Senadores  ,"Agazzi, Ernesto; Amorín, José; Ayala, Patricia; De León, Leonardo; Martínez Huelmo, Rubén; Michelini, Rafael; Mujica, José; Pardiñas, Yeru"
23,125018,2015-06-16,LEY,NACIONALIDAD URUGUAYA. MODIFICACIÓN.,Cámara Senadores  ,"Agazzi, Ernesto; Ayala, Patricia; De León, Leonardo; Martínez Huelmo, Rubén; Meléndez, Lauro; Michelini, Rafael; Mujica, José; Otheguy Vega, Marcos Javier; Pardiñas, Yeru; Passada, Ivonne; Paternain Rodríguez, Rafael; Payssé, Daniela; Pintado, Enrique; Topolansky, Lucía; Xavier, Mónica"
24,124969,2015-06-10,PROYECTO DE RESOLUCION   ,"MASSERA, José Luis. NACIMIENTO (100 AÑOS). CONMEMORACION. HOMENAJE.",Asamblea General  ,"Agazzi, Ernesto; Berterreche, Andrés; Bianchi, Daniel; Carámbula Volpi, Marcos Gustavo; Carballo Da Costa, Felipe; Castaingdebat, Armando; De León, Leonardo; Gelman, Macarena; Groba Arriondo, Oscar; Mahía, José Carlos; Martínez Huelmo, Rubén; Moreira, Constanza; Mujica, José; Pardiñas, Yeru; Passada, Ivonne; Payssé, Daniela; Pereyra, Susana; Pintado, Enrique; Pozzi, Jorge; Puig, Luis; Radío, Daniel; Sánchez, Alejandro; Topolansky, Lucía; Verri, Walter; Xavier, Mónica"
25,125265,2015-06-01,RESOLUCION   ,COMISIONADO PARLAMENTARIO. JUAN MIGUEL PETIT. DESIGNACIÓN. COMISIÓN ESPECIAL. CREACIÓN.,Asamblea General  ,"Agazzi, Ernesto; Ayala, Patricia; Berterreche, Andrés; Coutinho Rodríguez, Germán; De León, Leonardo; García, Javier; Martínez Huelmo, Rubén; Mieres, Pablo; Otheguy Vega, Marcos Javier"
26,125032,2015-04-15,PROYECTO DE RESOLUCION   ,"GALEANO, Eduardo. FALLECIMIENTO. HOMENAJE.",Cámara Senadores  ,"Agazzi, Ernesto; Alcorta, Ricardo; Asti, Alfredo; Battistoni, Julio; Carámbula Volpi, Marcos Gustavo; Civila, Gonzalo; De León, Leonardo; De los Santos, Oscar; González, Pablo; Malán, Enzo; Minetti, Orquídea; Passada, Ivonne; Payssé, Daniela; Pereyra, Susana; Sabini, Sebastián; Sánchez, Alejandro; Xavier, Mónica"
27,124090,2015-04-14,RESOLUCION   ,"GALEANO, Eduardo. FALLECIMIENTO. HOMENAJE.",Cámara Senadores  ,"Agazzi, Ernesto; Delgado, Alvaro; Mieres, Pablo; Montaner, Martha"
28,123986,2015-04-07,RESOLUCION   ,SEGURIDAD PÚBLICA Y CONVIVENCIA. COMISIÓN ESPECIAL. DESIGNACIÓN.,Cámara Senadores  ,"Agazzi, Ernesto; Delgado, Alvaro; Mieres, Pablo; Montaner, Martha"
29,123992,2015-04-07,DECLARACION,UNIVERSIDAD GARISSA. ATENTADO. VÍCTIMAS. SOLIDARIDAD. DECLARACIÓN.,Cámara Senadores  ,"Agazzi, Ernesto; Delgado, Alvaro; Larrañaga, Jorge; Mieres, Pablo; Montaner, Martha"
30,125032,2015-04-15,PROYECTO DE RESOLUCION   ,"GALEANO, Eduardo. FALLECIMIENTO. HOMENAJE.",Cámara Senadores  ,"Agazzi, Ernesto; Alcorta, Ricardo; Asti, Alfredo; Battistoni, Julio; Carámbula Volpi, Marcos Gustavo; Civila, Gonzalo; De León, Leonardo; De los Santos, Oscar; González, Pablo; Malán, Enzo; Minetti, Orquídea; Passada, Ivonne; Payssé, Daniela; Pereyra, Susana; Sabini, Sebastián; Sánchez, Alejandro; Xavier, Mónica"
31,124827,2015-05-26,RESOLUCION,"ALMAGRO, Luis.  SENADOR REPÚBLICA. RENUNCIA.",Cámara Senadores  ,"Almagro Lemes, Luis Leonardo"
32,138818,2018-03-09,PROYECTO DE RESOLUCION   ,"FERREIRA ALDUNATE, Wilson. FALLECIMIENTO. HOMENAJE.",Asamblea General  ,"Abdala, Pablo; Alonso, Verónica; Aviaga Martínez, María Carol; Camy Antognazza, Carlos Daniel; Cardoso, José Carlos; Charamelo, Richard; Delgado, Alvaro; Gandini, Jorge; García, Javier; García, Mario; Heber, Luis Alberto; Lacalle Pou, Luis Alberto; Lafluf, Omar; Larrañaga, Jorge; López Villalba, Daniel; Niffouri Blanco, Amín; Novales, Gonzalo; Olaizola, Juan José; Rodríguez, Gloria; Roselli, Edmundo; Yurramendi Pérez, José"
33,137830,2017-12-06,LEY,ENSEÑANZA. ELECCIONES UNIVERSITARIAS. MODIFICACIÓN.,Cámara Senadores  ,"Alonso, Verónica; Amorín, José; Ayala, Patricia; Besozzi, Guillermo; Bordaberry Herrán, Juan Pedro; Camy Antognazza, Carlos Daniel; Carámbula Volpi, Marcos Gustavo; Cardoso, José Carlos; Carrera Leal, Charles; Da Silva, Sebastián; De León, Leonardo; Delgado, Alvaro; Garin De Nardo, Daniel; Heber, Luis Alberto; Larrañaga, Jorge; Martínez Huelmo, Rubén; Michelini, Rafael; Moreira, Constanza; Mujica, José; Otheguy Vega, Marcos Javier; Passada, Ivonne; Payssé, Daniela; Pintado, Enrique; Saravia, Jorge; Tourné, Daisy; Xavier, Mónica"
34,137375,2017-11-07,LEY,INGENIERO ELADIO DIESTE SAN MARTÍN. CONMEMORACIÓN CENTENARIO NACIMIENTO. INTERÉS NACIONAL. DECLARACIÓN.,Cámara Senadores  ,"Alonso, Verónica; Amorín, José; Ayala, Patricia; Bordaberry Herrán, Juan Pedro; Carámbula Volpi, Marcos Gustavo; Carrera Leal, Charles; Coutinho Rodríguez, Germán; De León, Leonardo; Delgado, Alvaro; Garin De Nardo, Daniel; Heber, Luis Alberto; Martínez Huelmo, Rubén; Michelini, Rafael; Mieres, Pablo; Moreira, Constanza; Mujica, José; Otheguy Vega, Marcos Javier; Passada, Ivonne; Payssé, Daniela; Pintado, Enrique; Tourné, Daisy; Xavier, Mónica"
35,135267,2017-06-13,RESOLUCION   ,SECTORES POLITICOS. PRESUNTOS FINANCIAMIENTOS ILEGALES. COMISION PREINVESTIGADORA. CREACION.,Cámara Senadores  ,"Alonso, Verónica; Amorín, José; Aviaga Martínez, María Carol; Besozzi, Guillermo; Bianchi, Daniel; Bordaberry Herrán, Juan Pedro; Camy Antognazza, Carlos Daniel; Delgado, Alvaro; García, Javier; Heber, Luis Alberto; Lacalle Pou, Luis Alberto; Larrañaga, Jorge; Mieres, Pablo; Saravia, Jorge"
36,134583,2017-04-27,RESOLUCION   ,HAITÍ. MISION PAZ ONU (MINUSTAH). FUERZAS ARMADAS. RECONOCIMIENTO.,Cámara Senadores  ,"Alonso, Verónica; Amorín, José; Aviaga Martínez, María Carol; Besozzi, Guillermo; Camy Antognazza, Carlos Daniel; Delgado, Alvaro; García, Javier; Lacalle Pou, Luis Alberto; Larrañaga, Jorge; Mieres, Pablo; Saravia, Jorge"
37,132654,2016-11-14,PROYECTO DE LEY,SUBSIDIOS Y LICENCIA MATERNIDAD Y PATERNIDAD TRABAJADOR ACTIVIDAD PRIVADA. REGIMEN. MODIFICACIÓN.,Cámara Senadores  ,"Alonso, Verónica"
38,132308,2016-10-27,PROYECTO DE LEY,FUNCIONARIOS POLICIALES. USO LEGAL DE LA FUERZA. LEGITIMA DEFENSA. PRESUNCION. MODIFICACION DEL ARTICULO 26 DEL CODIGO PENAL.,Cámara Senadores  ,"Alonso, Verónica; Asiaín, Carmen; Besozzi, Guillermo; Cardoso, José Carlos; García, Javier; Heber, Luis Alberto; Lacalle Pou, Luis Alberto; Larrañaga, Jorge; Piñeyrúa Olmos, Ana Lía; Saravia, Jorge"
39,128594,2016-03-08,DECLARACION,"CÁCERES, Berta. ORGANIZACIONES POPULARES E INDÍGENAS HONDURAS. PRESIDENTA. ASESINATO. JUSTICIA. RECLAMO. DECLARACIÓN.",Cámara Senadores  ,"Agazzi, Ernesto; Alonso, Verónica; Aviaga Martínez, María Carol; Ayala, Patricia; Berterreche, Andrés; Bianchi, Daniel; Bordaberry Herrán, Juan Pedro; Camy Antognazza, Carlos Daniel; Coutinho Rodríguez, Germán; Delgado, Alvaro; García, Javier; Heber, Luis Alberto; Lacalle Pou, Luis Alberto; Lafluf, Omar; Larrañaga, Jorge; Martínez Huelmo, Rubén; Michelini, Rafael; Mieres, Pablo; Passada, Ivonne; Saravia, Jorge; Topolansky, Lucía"
40,127178,2015-11-03,PROYECTO DE RESOLUCION,VENEZUELA. SITUACIÓN POLÍTICA. EXPOSICION.,Cámara Senadores  ,"Alonso, Verónica; Amorín, José; Besozzi, Guillermo; Camy Antognazza, Carlos Daniel; Cardoso, José Carlos; Delgado, Alvaro; Eguiluz, Cecilia; Mieres, Pablo"
41,126823,2015-10-06,PROYECTO DE LEY,ESPACIO COSTERO. ORDENAMIENTO TERRITORIAL Y DESARROLLO SOSTENIBLE. NORMAS.,Cámara Senadores  ,"Alonso, Verónica; Aviaga Martínez, María Carol; Besozzi, Guillermo; Camy Antognazza, Carlos Daniel; Delgado, Alvaro; García, Javier; Lacalle Pou, Luis Alberto; Larrañaga, Jorge"
42,125462,2015-07-14,PROYECTO DE RESOLUCION   ,"SINGLET, Manuel. FALLECIMIENTO. HOMENAJE.",Cámara Senadores  ,"Agazzi, Ernesto; Alonso, Verónica; Camy Antognazza, Carlos Daniel; Coutinho Rodríguez, Germán; Delgado, Alvaro; Eguiluz, Cecilia; García, Javier; Lacalle Pou, Luis Alberto; Larrañaga, Jorge; Martínez Huelmo, Rubén; Mieres, Pablo; Montaner, Martha; Mujica, José; Topolansky, Lucía; Tourné, Daisy; Xavier, Mónica"
43,124777,2015-06-02,PROYECTO DE LEY,"ORIBE, Josefa. ESCUELA Nº 183 (MONTEVIDEO). DENOMINACIÓN.",Cámara Senadores  ,"Alonso, Verónica; Enciso Christiansen, Carlos"
44,124439,2015-05-11,PROYECTO DE MINUTA DE COMUNICACION,"CIENCIA, TECNOLOGÍA E INNOVACIÓN. MINISTERIO. CREACIÓN.",Cámara Senadores  ,"Alonso, Verónica; Fernández Farias, Eduardo; Martínez Huelmo, Rubén; Payssé, Daniela; Saravia, Jorge"
45,123873,2015-03-24,PROYECTO DE LEY,PACIENTES CON TRATAMIENTO MEDICO EN EL EXTERIOR. TRASLADO. MILLAS PASAJES OFICIALES. USO.,Cámara Senadores  ,"Alonso, Verónica; Aviaga Martínez, María Carol; Delgado, Alvaro; Enciso Christiansen, Carlos; García, Javier; Heber, Luis Alberto; Lacalle Pou, Luis Alberto; Moreira, Carlos"
46,139714,2018-05-10,DECLARACION,ARMENIA. REPUBLICA. CENTENARIO. HOMENAJE. DECLARACION.,Cámara Senadores  ,"Amorín, José; Delgado, Alvaro; Martínez Huelmo, Rubén; Mieres, Pablo"
47,137830,2017-12-06,LEY,ENSEÑANZA. ELECCIONES UNIVERSITARIAS. MODIFICACIÓN.,Cámara Senadores  ,"Alonso, Verónica; Amorín, José; Ayala, Patricia; Besozzi, Guillermo; Bordaberry Herrán, Juan Pedro; Camy Antognazza, Carlos Daniel; Carámbula Volpi, Marcos Gustavo; Cardoso, José Carlos; Carrera Leal, Charles; Da Silva, Sebastián; De León, Leonardo; Delgado, Alvaro; Garin De Nardo, Daniel; Heber, Luis Alberto; Larrañaga, Jorge; Martínez Huelmo, Rubén; Michelini, Rafael; Moreira, Constanza; Mujica, José; Otheguy Vega, Marcos Javier; Passada, Ivonne; Payssé, Daniela; Pintado, Enrique; Saravia, Jorge; Tourné, Daisy; Xavier, Mónica"
48,137709,2017-11-15,RESOLUCION,DESTINO FINAL. PELICULA. PRODUCCIÓN COPIAS. DVD. AUTORIZACIÓN,Cámara Senadores  ,"Amorín, José; De León, Leonardo; Heber, Luis Alberto; Michelini, Rafael; Mieres, Pablo"
49,137375,2017-11-07,LEY,INGENIERO ELADIO DIESTE SAN MARTÍN. CONMEMORACIÓN CENTENARIO NACIMIENTO. INTERÉS NACIONAL. DECLARACIÓN.,Cámara Senadores  ,"Alonso, Verónica; Amorín, José; Ayala, Patricia; Bordaberry Herrán, Juan Pedro; Carámbula Volpi, Marcos Gustavo; Carrera Leal, Charles; Coutinho Rodríguez, Germán; De León, Leonardo; Delgado, Alvaro; Garin De Nardo, Daniel; Heber, Luis Alberto; Martínez Huelmo, Rubén; Michelini, Rafael; Mieres, Pablo; Moreira, Constanza; Mujica, José; Otheguy Vega, Marcos Javier; Passada, Ivonne; Payssé, Daniela; Pintado, Enrique; Tourné, Daisy; Xavier, Mónica"
50,136846,2017-10-03,PROYECTO DE DECLARACION,MEXICO. TERREMOTO. EVENTOS CLIMATICOS. SOLIDARIDAD. PROYECTO DECLARACION.,Cámara Senadores  ,"Amorín, José; Cardoso, José Carlos; De León, Leonardo; Delgado, Alvaro; Mieres, Pablo"
51,136210,2017-08-09,DECLARACION,CAMBIO CLIMÁTICO. CONVENCIÓN MARCO NACIONES UNIDAS. COMPROMISO. DECLARACIÓN.,Cámara Senadores  ,"Amorín, José; Aviaga Martínez, María Carol; Besozzi, Guillermo; Bianchi, Daniel; Bordaberry Herrán, Juan Pedro; Camy Antognazza, Carlos Daniel; Cardozo Rufo, Virginia; Coutinho Rodríguez, Germán; De León, Leonardo; Delgado, Alvaro; García, Javier; Garin De Nardo, Daniel; Heber, Luis Alberto; Lacalle Pou, Luis Alberto; Larrañaga, Jorge; Mieres, Pablo"
52,135267,2017-06-13,RESOLUCION   ,SECTORES POLITICOS. PRESUNTOS FINANCIAMIENTOS ILEGALES. COMISION PREINVESTIGADORA. CREACION.,Cámara Senadores  ,"Alonso, Verónica; Amorín, José; Aviaga Martínez, María Carol; Besozzi, Guillermo; Bianchi, Daniel; Bordaberry Herrán, Juan Pedro; Camy Antognazza, Carlos Daniel; Delgado, Alvaro; García, Javier; Heber, Luis Alberto; Lacalle Pou, Luis Alberto; Larrañaga, Jorge; Mieres, Pablo; Saravia, Jorge"
53,134851,2017-05-16,PROYECTO DE LEY,PORTABILIDAD NUMERICA MOVIL. REGIMEN.,Cámara Senadores  ,"Amorín, José"
54,134583,2017-04-27,RESOLUCION   ,HAITÍ. MISION PAZ ONU (MINUSTAH). FUERZAS ARMADAS. RECONOCIMIENTO.,Cámara Senadores  ,"Alonso, Verónica; Amorín, José; Aviaga Martínez, María Carol; Besozzi, Guillermo; Camy Antognazza, Carlos Daniel; Delgado, Alvaro; García, Javier; Lacalle Pou, Luis Alberto; Larrañaga, Jorge; Mieres, Pablo; Saravia, Jorge"
55,133794,2017-03-08,PROYECTO DE RESOLUCION   ,DÍA INTERNACIONAL MUJER. CONMEMORACIÓN. HOMENAJE.,Cámara Senadores  ,"Amorín, José; De León, Leonardo; Delgado, Alvaro; Mieres, Pablo"
56,132939,2016-11-30,PROYECTO DE RESOLUCION   ,"SEREGNI, Liber. CONMEMORACION 100 AÑOS NACIMIENTO. HOMENAJE.",Asamblea General  ,"Amarilla, Gerardo; Amorín, José; Barreiro, Gabriela; Chiazzaro, Roberto; Civila, Gonzalo; de los Santos Severgnini, Darcy Amaury; Delgado, Alvaro; Mahía, José Carlos; Michelini, Rafael; Mieres, Pablo; Núñez, Gerardo; Radío, Daniel; Rodríguez, Conrado; Sanseverino, Berta; Santalla, Mercedes; Topolansky, Lucía; Xavier, Mónica"
57,132470,2016-11-01,PROYECTO DE DECLARACION,NICARAGUA. PROCESO ELECTORAL. RECHAZO. DECLARACIÓN.,Cámara Senadores  ,"Amorín, José; Delgado, Alvaro; Mieres, Pablo"
58,132477,2016-11-01,DECLARACION,REPÚBLICA ITALIANA. TERREMOTOS. SOLIDARIDAD. MANIFESTACIONES.,Cámara Senadores  ,"Agazzi, Ernesto; Amorín, José; Delgado, Alvaro; Heber, Luis Alberto; Mieres, Pablo"
59,131924,2016-10-04,DECLARACION,"HARTMAN, Rúben. DELITOS LESA HUMANIDAD. PALABRAS REIVINDICACION ACCIONAR MILITARES. REPUDIO. DECLARACIÓN.",Cámara Senadores  ,"Amorín, José; Bordaberry Herrán, Juan Pedro; De León, Leonardo; Michelini, Rafael; Mieres, Pablo; Pintado, Enrique"
60,131639,2016-09-13,LEY,GOBIERNOS DEPARTAMENTALES. FUNCIONARIOS. INGRESOS SALARIALES. TOPES. APLICACION.,Cámara Senadores  ,"Amorín, José; Bordaberry Herrán, Juan Pedro; Camy Antognazza, Carlos Daniel; Delgado, Alvaro; Heber, Luis Alberto; Michelini, Rafael; Mieres, Pablo; Otheguy Vega, Marcos Javier"
61,131046,2016-08-03,PROYECTO DE RESOLUCION   ,"BATLLE, José Luis. EX LEGISLADOR. HOMENAJE.",Cámara Senadores  ,"Amorín, José"
62,130857,2016-07-21,PROYECTO DE LEY,CONTRIBUYENTES. DERECHOS. NORMAS.,Cámara Senadores  ,"Amorín, José"
63,130529,2016-05-24,RESOLUCION,PRESIDENTE REPUBLICA. MENSAJE ANUAL. SITUACION PAIS. SESION EXTRAORDINARIA. REALIZACION.,Cámara Senadores  ,"Amorín, José; Bianchi, Daniel; Bordaberry Herrán, Juan Pedro; Coutinho Rodríguez, Germán; Delgado, Alvaro; Mieres, Pablo"
64,129690,2016-05-17,RESOLUCION,CAMPAÑA VIOLENCIA CONTRA NIÑOS ¡YA ES HORA!. CAMARA SENADORES. ADHESION.,Cámara Senadores  ,"Amorín, José; Bordaberry Herrán, Juan Pedro; Delgado, Alvaro; Mieres, Pablo; Topolansky, Lucía; Tourné, Daisy"
65,129710,2016-05-17,PROYECTO DE RESOLUCION   ,"MICHELINI, Zelmar, GUTIERREZ RUIZ, Héctor. EX LEGISLADORES. HOMENAJE.",Asamblea General  ,"Amorín, José; Chiazzaro, Roberto; De León, Leonardo; De los Santos, Oscar; Delgado, Alvaro; Gandini, Jorge; González, Pablo; Heber, Luis Alberto; Mahía, José Carlos; Meroni, Jorge; Minetti, Orquídea; Mujica, José; Pasquet Iribarne, Ope; Payssé, Daniela; Posada, Iván; Querejeta, José; Rubio, Eduardo"
66,129450,2016-05-04,PROYECTO DE RESOLUCION   ,LAVADO ACTIVOS. FRAUDE FINANCIERO. PREVENCION. COMISION ESPECIAL. CREACION.,Cámara Senadores  ,"Amorín, José; Delgado, Alvaro; Martínez Huelmo, Rubén; Michelini, Rafael; Mieres, Pablo"
67,129292,2016-04-26,PROYECTO DE LEY,ENVASES PRIMARIOS NO RETORNABLES. USO. PROHIBICIÓN. MODIFICACIÓN.,Cámara Senadores  ,"Amorín, José"
68,128824,2016-03-29,PROYECTO DE LEY,DIA CONTRA AGRESIONES TRABAJADORES SALUD (NACIONAL). DECLARACION.,Cámara Senadores  ,"Amorín, José"
69,128759,2016-03-16,PROYECTO DE RESOLUCION   ,"MONTANER, MARTHA. FALLECIMIENTO. HOMENAJE.",Asamblea General  ,"Amado, Fernando; Amorín, José; Bianchi, Daniel; Bordaberry Herrán, Juan Pedro; Coutinho Rodríguez, Germán; Eguiluz, Cecilia; Leal Alvarez, Auber Agapito; Matiaude, Graciela; Mieres, Pablo; Osta, Gustavo; Pasquet Iribarne, Ope; Verri, Walter"
70,128447,2016-03-02,PROYECTO DE RESOLUCION   ,"PALME, Olof. TRAYECTORIA. HOMENAJE.",Cámara Senadores  ,"Amorín, José; Bordaberry Herrán, Juan Pedro; Coutinho Rodríguez, Germán; Delgado, Alvaro; Ramos, Conrado; Tourné, Daisy"
71,127178,2015-11-03,PROYECTO DE RESOLUCION,VENEZUELA. SITUACIÓN POLÍTICA. EXPOSICION.,Cámara Senadores  ,"Alonso, Verónica; Amorín, José; Besozzi, Guillermo; Camy Antognazza, Carlos Daniel; Cardoso, José Carlos; Delgado, Alvaro; Eguiluz, Cecilia; Mieres, Pablo"
72,126602,2015-09-16,RESOLUCION   ,"VASCONCELLOS, Amílcar. HOMENAJE.",Cámara Senadores  ,"Amorín, José; Heber, Luis Alberto; Michelini, Rafael; Mieres, Pablo"
73,125014,2015-06-16,LEY,"FRUTAS, FLORES Y HORTALIZAS. IVA. FONDO RECONSTRUCCION Y FOMENTO DE LA GRANJA. FINANCIACION. PRORROGA.",Cámara Senadores  ,"Agazzi, Ernesto; Amorín, José; Ayala, Patricia; De León, Leonardo; Martínez Huelmo, Rubén; Michelini, Rafael; Mujica, José; Pardiñas, Yeru"
74,129125,2015-04-13,RESOLUCION   ,"LACARTE MURO, Julio. FALLECIMIENTO. HOMENAJE.",Cámara Senadores  ,"Amorín, José; Bordaberry Herrán, Juan Pedro"
