,id_ficha,fecha_entrada,tipo,titulo,origen,presentado_por
372,138864,2018-03-13,PROYECTO DE LEY,JUDICATURA Y ORGANIZACIÓN TRIBUNALES. LEY ORGÁNICA. MODIFICACIÓN.,Cámara Senadores  ,"Carrera Leal, Charles; De León, Leonardo; Garin De Nardo, Daniel; Michelini, Rafael; Mujica, José; Otheguy Vega, Marcos Javier; Passada, Ivonne; Payssé, Daniela; Pintado, Enrique; Tourné, Daisy; Xavier, Mónica"
373,138859,2018-03-13,PROYECTO DE LEY,DELITOS. VÍCTIMAS Y TESTIGOS. ATENCIÓN Y PROTECCIÓN. INTERÉS GENERAL. DECLARACIÓN.,Cámara Senadores  ,"Carrera Leal, Charles; De León, Leonardo; Garin De Nardo, Daniel; Michelini, Rafael; Mujica, José; Otheguy Vega, Marcos Javier; Payssé, Daniela; Pintado, Enrique; Tourné, Daisy; Xavier, Mónica"
374,138863,2018-03-13,PROYECTO DE LEY,ACCIÓN DE NULIDAD ANTE EL TCA. REFORMAS PROCESALES.,Cámara Senadores  ,"Carrera Leal, Charles; De León, Leonardo; Garin De Nardo, Daniel; Michelini, Rafael; Mujica, José; Otheguy Vega, Marcos Javier; Passada, Ivonne; Payssé, Daniela; Pintado, Enrique; Tourné, Daisy; Xavier, Mónica"
375,138643,2018-03-06,MINUTA DE COMUNICACION,PRINCIPIO IGUALDAD. MUJERES-HOMBRES. SALARIO. PROMOCION.,Cámara Senadores  ,"Ayala, Patricia; Carrera Leal, Charles; Castillo, Juan; De León, Leonardo; Martínez Huelmo, Rubén; Michelini, Rafael; Moreira, Constanza; Otheguy Vega, Marcos Javier; Passada, Ivonne; Payssé, Daniela; Pintado, Enrique; Tourné, Daisy; Xavier, Mónica"
376,137830,2017-12-06,LEY,ENSEÑANZA. ELECCIONES UNIVERSITARIAS. MODIFICACIÓN.,Cámara Senadores  ,"Alonso, Verónica; Amorín, José; Ayala, Patricia; Besozzi, Guillermo; Bordaberry Herrán, Juan Pedro; Camy Antognazza, Carlos Daniel; Carámbula Volpi, Marcos Gustavo; Cardoso, José Carlos; Carrera Leal, Charles; Da Silva, Sebastián; De León, Leonardo; Delgado, Alvaro; Garin De Nardo, Daniel; Heber, Luis Alberto; Larrañaga, Jorge; Martínez Huelmo, Rubén; Michelini, Rafael; Moreira, Constanza; Mujica, José; Otheguy Vega, Marcos Javier; Passada, Ivonne; Payssé, Daniela; Pintado, Enrique; Saravia, Jorge; Tourné, Daisy; Xavier, Mónica"
377,137658,2017-11-22,LEY,CÓDIGO DEL PROCESO PENAL. LEY 19.293. MATERIA INFRACCIONAL ADOLESCENTE. INCORPORACIÓN.,Cámara Senadores  ,"Ayala, Patricia; Carrera Leal, Charles; De León, Leonardo; Garin De Nardo, Daniel; Lazo, Sandra; Martínez Huelmo, Rubén; Michelini, Rafael; Moreira, Constanza; Otheguy Vega, Marcos Javier; Payssé, Daniela; Suárez Bertora, Michelle; Xavier, Mónica"
378,137519,2017-11-14,PROYECTO DE LEY,SEDES PODER JUDICIAL. SISTEMA DE REGISTRO DE AUDIENCIAS. FUNCIONAMIENTO.,Cámara Senadores  ,"Ayala, Patricia; Carrera Leal, Charles; De León, Leonardo; Garin De Nardo, Daniel; Martínez Huelmo, Rubén; Michelini, Rafael; Otheguy Vega, Marcos Javier; Passada, Ivonne; Payssé, Daniela; Tourné, Daisy; Xavier, Mónica"
379,137375,2017-11-07,LEY,INGENIERO ELADIO DIESTE SAN MARTÍN. CONMEMORACIÓN CENTENARIO NACIMIENTO. INTERÉS NACIONAL. DECLARACIÓN.,Cámara Senadores  ,"Alonso, Verónica; Amorín, José; Ayala, Patricia; Bordaberry Herrán, Juan Pedro; Carámbula Volpi, Marcos Gustavo; Carrera Leal, Charles; Coutinho Rodríguez, Germán; De León, Leonardo; Delgado, Alvaro; Garin De Nardo, Daniel; Heber, Luis Alberto; Martínez Huelmo, Rubén; Michelini, Rafael; Mieres, Pablo; Moreira, Constanza; Mujica, José; Otheguy Vega, Marcos Javier; Passada, Ivonne; Payssé, Daniela; Pintado, Enrique; Tourné, Daisy; Xavier, Mónica"
380,137300,2017-11-01,PROYECTO DE LEY,INSTITUCION DERECHOS HUMANOS (NACIONAL). LEY 18446. MODIFICACION,Cámara Senadores  ,"Ayala, Patricia; Carámbula Volpi, Marcos Gustavo; Carrera Leal, Charles; De León, Leonardo; Gallicchio Queirolo, Antonio; Garin De Nardo, Daniel; Moreira, Constanza; Otheguy Vega, Marcos Javier; Passada, Ivonne; Payssé, Daniela; Pintado, Enrique; Tourné, Daisy; Xavier, Mónica"
381,137048,2017-10-11,PROYECTO DE LEY,TESTIGOS Y DENUNCIANTES. RESERVA IDENTIDAD. INSPECCIÓN GENERAL TRABAJO Y SEGURIDAD SOCIAL.,Cámara Senadores  ,"Aristimuño, Saúl; Carrera Leal, Charles; Ferreira, Zulimar; García, Graciela; Garin De Nardo, Daniel; Michelini, Rafael; Otheguy Vega, Marcos Javier; Pintado, Enrique; Suárez Bertora, Michelle; Xavier, Mónica"
382,137051,2017-10-10,PROYECTO DE LEY,BANCA. TITULARIDAD. ELECCIONES NACIONALES.,Cámara Senadores  ,"Aristimuño, Saúl; Ayala, Patricia; Carrera Leal, Charles; García, Graciela; Garin De Nardo, Daniel; Michelini, Rafael; Moreira, Constanza; Mujica, José; Otheguy Vega, Marcos Javier; Payssé, Daniela; Pintado, Enrique; Suárez Bertora, Michelle; Xavier, Mónica"
383,142562,2019-03-06,PROYECTO DE RESOLUCION   ,"FERREIRA ALDUNATE, Wilson. FALLECIMIENTO. HOMENAJE.",Asamblea General  ,"Abdala, Pablo; Andújar, Sebastián; Aviaga Martínez, María Carol; Bacigalupe Aunés, Rubén Aníbal; Camy Antognazza, Carlos Daniel; Castaingdebat, Armando; Charamelo, Richard; Delgado, Alvaro; Gandini, Jorge; García, Mario; Goñi Reyes, Rodrigo; Heber, Luis Alberto; Irazábal Calleri, Benjamín Eduardo; Lema, Martín; Niffouri Blanco, Amín; Penadés, Gustavo; Yurramendi Pérez, José"
384,141548,2018-10-16,PROYECTO DE LEY,GANADERIA OVINA. PROMOCION Y RECUPERACION. REGIMEN.,Cámara Representantes  ,"Castaingdebat, Armando; Roselli, Edmundo; Umpiérrez, Alejo"
385,140095,2018-06-12,PROYECTO DE LEY,CARNICERIAS INTERIOR PAIS. ELABORACION PRODUCTOS EMBUTIDOS ARTESANALES. REGLAMENTACION.,Cámara Representantes  ,"Castaingdebat, Armando; Fratti, Luis Alfredo; Larzábal, Nelson; Ruiz, Juan Federico"
386,138412,2018-02-08,RESOLUCION,FONDO GARANTIA DEUDAS PRODUCTORES LECHEROS. CREACION.,Cámara Representantes  ,"Castaingdebat, Armando; Fratti, Luis Alfredo; González, Sebastián; Pasquet Iribarne, Ope; Posada, Iván; Roselli, Edmundo; Umpiérrez, Alejo"
387,137525,2017-11-14,PROYECTO DE LEY,DIA NACIONAL IGLESIAS EVANGELICAS Y PROTESTANTES- 31 OCTUBRE. DECLARACION.,Cámara Representantes  ,"Abdala, Pablo; Amarilla, Gerardo; Arocena Argul, José Andrés; Castaingdebat, Armando; Dastugue, Álvaro; Irazábal Calleri, Benjamín Eduardo; Matiaude, Graciela; Niffouri Blanco, Amín"
388,137016,2017-10-10,PROYECTO DE DECLARACION,PAISES CENTROAMERICA AFECTADOS FENOMENOS CLIMATICOS.  SOLIDARIDAD. DECLARACION.,Cámara Representantes  ,"Amarilla, Gerardo; Arocena Argul, José Andrés; Castaingdebat, Armando; Niffouri Blanco, Amín; Olaizola, Juan José; Penadés, Gustavo"
389,137017,2017-10-10,PROYECTO DE LEY,"FAMILIARES MILITAR, POLICIA O CIVIL FALLECIDO LUCHA SEDICION. REPARACION PATRIMONIAL.",Cámara Representantes  ,"Amarilla, Gerardo; Amorín, Juan José; Andújar, Sebastián; Arbiza, Sergio Orlando; Arocena Argul, José Andrés; Bianchi, Graciela; Castaingdebat, Armando; Gandini, Jorge; García, Mario; Irazábal Calleri, Benjamín Eduardo; Lamorte, Aldo; Niffouri Blanco, Amín; Penadés, Gustavo; Quintela, Mabel; Rodríguez, Valentín; Rodríguez, Gloria; Trobo, Jaime Mario; Yurramendi Pérez, José; Zabaleta, Oscar"
390,136681,2017-09-13,MINUTA DE COMUNICACION,MORTANDAD ABEJAS. MECANISMOS LEGALES. INSTRUMENTACION.,Cámara Representantes  ,"Castaingdebat, Armando; Delsa, Paulino; Eguiluz, Cecilia; Fratti, Luis Alfredo; Larzábal, Nelson; Minetti, Orquídea; Mujica, Gonzalo; Mutti Fornaroli, María Manuela; Posada, Iván; Roselli, Edmundo; Rubio, Eduardo; Ruiz, Juan Federico; Umpiérrez, Alejo; Varela Nestier, Carlos"
391,135121,2017-06-06,PROYECTO DE LEY,CONDUCTORES. ALCOHOL EN SANGRE. TOLERANCIA CERO. FLEXIBILIZACION.,Cámara Representantes  ,"Castaingdebat, Armando; Niffouri Blanco, Amín"
392,134856,2017-05-16,PROYECTO DE LEY,"MICHELINI, Zelmar. RUTA 109 TRAMO AIGUA - ROCHA. DENOMINACION.",Cámara Representantes  ,"Abdala, Pablo; Amarilla, Gerardo; Asti, Alfredo; Ayala, Mario; Caballero, Irene; Caggiani, Daniel; Castaingdebat, Armando; Coitiño, Carlos; De los Santos, Oscar; Lafluf, Omar; Mahía, José Carlos; Mendiondo, Constante; Mier, Sergio; Mier Estades, Egardo Dionisio; Olivera, Nicolás; Pasquet Iribarne, Ope; Penadés, Gustavo; Pereyra, Susana; Posada, Iván; Pozzi, Jorge; Radío, Daniel; Rapela, Valentina; Rodríguez, Conrado; Rubio, Eduardo; Sosa Acosta, Heriberto; Tierno, Martín; Umpiérrez, Alejo; Varela Nestier, Carlos; Verri, Walter; Viera Duarte, Tabaré; Yurramendi Pérez, José"
393,134860,2017-05-16,PROYECTO DE LEY,"CAMACHO, Hugo. POLICLINICA ISMAEL CORTINAS (FLORES). DENOMINACION.",Cámara Representantes  ,"Castaingdebat, Armando; Ruiz, Juan Federico"
394,134313,2017-04-04,PROYECTO DE RESOLUCION,VENEZUELA. INSTITUCIONES DEMOCRATICAS. RESTABLECIMIENTO. EXHORTACION.,Cámara Representantes  ,"Abdala, Pablo; Arocena Argul, José Andrés; Bacigalupe Aunés, Rubén Aníbal; Bianchi, Graciela; Casaretto, Federico; Castaingdebat, Armando; Gandini, Jorge; Goñi Reyes, Rodrigo; Irazábal Calleri, Benjamín Eduardo; Lema, Martín; Mier Estades, Egardo Dionisio; Niffouri Blanco, Amín; Olaizola, Juan José; Olivera, Nicolás; Penadés, Gustavo; Rocha, Patricia; Rodríguez, Gloria; Roselli, Edmundo; Trobo, Jaime Mario; Umpiérrez, Alejo; Yurramendi Pérez, José; Zabaleta, Oscar"
395,133330,2016-12-28,PROYECTO DE LEY,ADULTO MAYOR. CODIGO. APROBACION.,Cámara Representantes  ,"Amarilla, Gerardo; Arocena Argul, José Andrés; Castaingdebat, Armando; Irazábal Calleri, Benjamín Eduardo; Lema, Martín; Rodríguez, Gloria; Rodríguez Servetto, Nelson; Trobo, Jaime Mario; Zoulamián, Antonio"
396,133071,2016-12-07,MINUTA DE COMUNICACION,ACEITE OLIVA. IMPORTACION. CERTIFICADO CALIDAD. DECRETO. INSTRUMENTACION.,Cámara Representantes  ,"Cáceres, Richard; Castaingdebat, Armando; Fratti, Luis Alfredo; Larzábal, Nelson; Ruiz, Juan Federico; Umpiérrez, Alejo"
397,131661,2016-09-14,PROYECTO DE LEY,CARNE OVINA. FONDO INVESTIGACION Y FOMENTO. CREACION.,Cámara Representantes  ,"Castaingdebat, Armando; Fratti, Luis Alfredo; Larzábal, Nelson; Pasquet Iribarne, Ope; Posada, Iván; Roselli, Edmundo; Ruiz, Juan Federico; Umpiérrez, Alejo"
398,130608,2016-07-05,PROYECTO DE LEY,INSTITUTO NACIONAL BIENESTAR ANIMAL. CREACION.,Cámara Representantes  ,"Castaingdebat, Armando; Lema, Martín"
399,129429,2016-05-03,PROYECTO DE LEY,"GUTIERREZ RUIZ, Héctor. ESCUELA 330 (MONTEVIDEO). DENOMINACION.",Cámara Representantes  ,"Abdala, Pablo; Acosta, Auro; Amarilla, Gerardo; Andújar, Sebastián; Arocena Argul, José Andrés; Arrieta, Elisabeth; Ayala, Mario; Bacigalupe Aunés, Rubén Aníbal; Bianchi, Graciela; Casaretto, Federico; Castaingdebat, Armando; Díaz Angüilla, Pablo; Estrada, Ignacio; Ezquerra Alonso, W. Aparicio; Fontes, Nicolás; Gandini, Jorge; García, Mario; Gianoli, Gabriel; Goñi Reyes, Rodrigo; Irazábal Calleri, Benjamín Eduardo; Lafluf, Omar; Lamorte, Aldo; Lema, Martín; Mier Estades, Egardo Dionisio; Niffouri Blanco, Amín; Novales, Gonzalo; Olaizola, Juan José; Penadés, Gustavo; Rodríguez, Gloria; Roselli, Edmundo; Vásquez Varela, Patricia; Yurramendi Pérez, José"
400,129428,2016-05-03,LEY,INMUEBLES RURALES. ENAJENACION. OPCION COMPRA INC. REGIMEN. MODIFICACION.,Cámara Representantes  ,"Castaingdebat, Armando; Roselli, Edmundo; Umpiérrez, Alejo"
401,127929,2015-12-15,PROYECTO DE RESOLUCION,DECLARACIONES JOSE MUJICA CAMPAÑA ELECTORAL. INCONSTITUCIONALIDAD. CORTE ELECTORAL. CONSIDERACION. SOLICITUD.,Cámara Senadores  ,"Asiaín, Carmen; Besozzi, Guillermo; Bianchi, Daniel; Bordaberry Herrán, Juan Pedro; Camy Antognazza, Carlos Daniel; Castaingdebat, Armando; Coutinho Rodríguez, Germán; Delgado, Alvaro; García, Javier; Heber, Luis Alberto; López Villalba, Daniel; Piñeyrúa Olmos, Ana Lía; Saravia, Jorge"
402,127931,2015-12-15,PROYECTO DE RESOLUCION,DECLARACIONES JOSE MUJICA CAMPAÑA ELECTORAL Y REGISTROS FOTOGRAFICOS. INCONSTITUCIONALIDAD. CORTE ELECTORAL. CONSIDERACION. SOLICITUD.,Cámara Senadores  ,"Bianchi, Daniel; Bordaberry Herrán, Juan Pedro; Castaingdebat, Armando; Coutinho Rodríguez, Germán; Delgado, Alvaro; Heber, Luis Alberto; Piñeyrúa Olmos, Ana Lía"
403,127438,2015-11-17,RESOLUCION,ATENTADO TERRORISTA PARIS (FRANCIA). REPUDIO.,Cámara Representantes  ,"Abdala, Pablo; Amarilla, Gerardo; Arrieta, Elisabeth; Ayala, Mario; Castaingdebat, Armando; Dastugue, Álvaro; Gandini, Jorge; García, Mario; Goñi Reyes, Rodrigo; Lafluf, Omar; Niffouri Blanco, Amín; Olivera González, Flor; Olivera, Nicolás; Quintela, Mabel; Roselli, Edmundo; Trobo, Jaime Mario; Yurramendi Pérez, José; Zoulamián, Antonio"
404,127266,2015-11-10,PROYECTO DE LEY,PSICOLOGO. TITULO. HABILITACION. PLAZO. PRORROGA.,Cámara Representantes  ,"Castaingdebat, Armando; Viera Duarte, Tabaré"
405,126052,2015-08-18,PROYECTO DE LEY,ESPECTACULOS PUBLICOS. DERECHO ADMISION Y PERMANENCIA. COMPETENCIA MINISTERIO INTERIOR.,Cámara Representantes  ,"Amarilla, Gerardo; Bacigalupe Aunés, Rubén Aníbal; Bianchi, Graciela; Castaingdebat, Armando; Irazábal Calleri, Benjamín Eduardo; Martinelli, Nicolás José; Niffouri Blanco, Amín; Olaizola, Juan José; Trobo, Jaime Mario"
406,124969,2015-06-10,PROYECTO DE RESOLUCION   ,"MASSERA, José Luis. NACIMIENTO (100 AÑOS). CONMEMORACION. HOMENAJE.",Asamblea General  ,"Agazzi, Ernesto; Berterreche, Andrés; Bianchi, Daniel; Carámbula Volpi, Marcos Gustavo; Carballo Da Costa, Felipe; Castaingdebat, Armando; De León, Leonardo; Gelman, Macarena; Groba Arriondo, Oscar; Mahía, José Carlos; Martínez Huelmo, Rubén; Moreira, Constanza; Mujica, José; Pardiñas, Yeru; Passada, Ivonne; Payssé, Daniela; Pereyra, Susana; Pintado, Enrique; Pozzi, Jorge; Puig, Luis; Radío, Daniel; Sánchez, Alejandro; Topolansky, Lucía; Verri, Walter; Xavier, Mónica"
407,124476,2015-05-12,PROYECTO DE LEY,RESPONSABLE MENOR INFRACTOR. OMISION PATRIA POTESTAD. CODIGO PENAL. MODIFICACION.,Cámara Representantes  ,"Amarilla, Gerardo; Andújar, Sebastián; Arocena Argul, José Andrés; Bacigalupe Aunés, Rubén Aníbal; Bianchi, Graciela; Castaingdebat, Armando; Lema, Martín; Niffouri Blanco, Amín; Olaizola, Juan José; Rodríguez Servetto, Nelson"
408,124478,2015-05-12,PROYECTO DE LEY,SUBSIDIO TRANSITORIO INCAPACIDAD PARCIAL. REGIMEN. MODIFICACION.,Cámara Representantes  ,"Amarilla, Gerardo; Andújar, Sebastián; Arocena Argul, José Andrés; Bacigalupi, Marcelo; Bianchi, Graciela; Castaingdebat, Armando; Lema, Martín; Niffouri Blanco, Amín; Olaizola, Juan José; Rodríguez Servetto, Nelson"
409,123959,2015-04-07,PROYECTO DE LEY,HIDROCARBUROS. EXPLORACION Y EXPLOTACION. PERFORACION HIDRAULICA. PROHIBICION.,Cámara Representantes  ,"Amarilla, Gerardo; Andújar, Sebastián; Arocena Argul, José Andrés; Bacigalupe Aunés, Rubén Aníbal; Castaingdebat, Armando; Lema, Martín; Matiaude, Graciela; Olaizola, Juan José; Olivera, Nicolás; Rubio, Eduardo; Verri, Walter; Vidalín, Carmelo"
410,123750,2015-03-17,PROYECTO DE LEY,AGUINALDO Y SALARIO VACACIONAL. IRPF. EXONERACION.,Cámara Representantes  ,"Andújar, Sebastián; Bacigalupe Aunés, Rubén Aníbal; Cardoso, José Carlos; Castaingdebat, Armando; Goñi Reyes, Rodrigo; Lema, Martín; Niffouri Blanco, Amín; Olaizola, Juan José; Penadés, Gustavo; Rodríguez, Gloria; Rodríguez Servetto, Nelson; Trobo, Jaime Mario"
411,123529,2015-03-04,PROYECTO DE LEY,VIDA. DERECHO. PROTECCION.,Cámara Representantes  ,"Abdala, Pablo; Amarilla, Gerardo; Arocena Argul, José Andrés; Castaingdebat, Armando; Dastugue, Álvaro; Goñi Reyes, Rodrigo; Vidalín, Carmelo"
412,123524,2015-03-04,PROYECTO DE LEY,CANCER PROSTATA. EXAMEN PREVENCION. TRABAJADOR Y FUNCIONARIO PUBLICO. LICENCIA. OTORGAMIENTO.,Cámara Representantes  ,"Amarilla, Gerardo; Andújar, Sebastián; Arocena Argul, José Andrés; Bianchi, Graciela; Castaingdebat, Armando; Goñi Reyes, Rodrigo; Lema, Martín; Niffouri Blanco, Amín; Olaizola, Juan José; Vidalín, Carmelo"
413,123530,2015-03-04,PROYECTO DE LEY,VIOLENCIA DOMESTICA. AGRESOR DEPENDIENTE DROGAS. INTERNACION. REGIMEN.,Cámara Representantes  ,"Amarilla, Gerardo; Arocena Argul, José Andrés; Bianchi, Graciela; Castaingdebat, Armando; Goñi Reyes, Rodrigo; Niffouri Blanco, Amín; Olaizola, Juan José"
414,123542,2015-03-04,PROYECTO DE LEY,VIOLENCIA DOMESTICA. AGRESOR DEPENDIENTE DROGAS. INTERNACION. REGIMEN.,Cámara Representantes  ,"Amarilla, Gerardo; Arocena Argul, José Andrés; Bianchi, Graciela; Castaingdebat, Armando; Goñi Reyes, Rodrigo; Niffouri Blanco, Amín; Olaizola, Juan José"
415,123531,2015-03-04,PROYECTO DE LEY,ACCESIBILIDAD UNIVERSAL VIA PUBLICA. OBRAS ORGANISMOS PUBLICOS. REQUISITOS.,Cámara Representantes  ,"Amarilla, Gerardo; Arocena Argul, José Andrés; Bianchi, Graciela; Castaingdebat, Armando; Dastugue, Álvaro; Goñi Reyes, Rodrigo; Lema, Martín; Niffouri Blanco, Amín; Olaizola, Juan José; Rodríguez, Gloria; Rodríguez Servetto, Nelson; Vidalín, Carmelo"
416,143141,2019-04-08,PROYECTO DE LEY,CODIGO PROCESO (GENERAL). MODIFICACION.,Cámara Senadores  ,"Ayala, Patricia; Carrera Leal, Charles; Castillo, Juan; García, Graciela; Paternain Rodríguez, Rafael; Ribero, María Sara; Tourné, Daisy; Vassallo, Miguel; Xavier, Mónica"
417,143084,2019-04-02,PROYECTO DE MINUTA DE COMUNICACION,BUSTO PROCER JOSE ARTIGAS. UNIVERSIDAD ESTATAL SAN PETERSBURGO. DONACION.,Cámara Senadores  ,"Ayala, Patricia; Baráibar, Carlos; Berterreche, Andrés; Castillo, Juan; Michelini, Rafael; Moreira, Constanza; Otheguy Vega, Marcos Javier"
418,142063,2018-12-05,PROYECTO DE LEY,LICENCIADO EN NUTRICIÓN. PROFESIÓN UNIVERSITARIA. REGULACIÓN MARCO JURÍDICO.,Cámara Senadores  ,"Aristimuño, Saúl; Ayala, Patricia; Baráibar, Carlos; Besozzi, Guillermo; Bordaberry Herrán, Juan Pedro; Carrera Leal, Charles; Castillo, Juan; Delgado, Alvaro; García, Javier; Garin De Nardo, Daniel; Gomori Rettich, Eva Cristina; Michelini, Rafael; Mieres, Pablo; Moreira, Constanza; Otheguy Vega, Marcos Javier; Pardiñas, Yeru; Passada, Ivonne; Xavier, Mónica"
419,141848,2018-11-14,PROYECTO DE LEY,"TERRA, Gabriel. REPRESA. DENOMINACIÓN. MODIFICACIÓN.",Cámara Senadores  ,"Aristimuño, Saúl; Ayala, Patricia; Berterreche, Andrés; Carrera Leal, Charles; Castillo, Juan; Garin De Nardo, Daniel; Martínez Huelmo, Rubén; Michelini, Rafael; Moreira, Constanza; Otheguy Vega, Marcos Javier; Passada, Ivonne; Payssé, Daniela; Pintado, Enrique; Tourné, Daisy; Xavier, Mónica"
420,141494,2018-10-09,PROYECTO DE LEY,EJERCICIO FUNCIÓN PÚBLICA. BUENAS PRÁCTICAS. ADECUACIÓN. INTERÉS GENERAL. DECLARACIÓN.,Cámara Senadores  ,"Ayala, Patricia; Berterreche, Andrés; Carrera Leal, Charles; Castillo, Juan; De León, Leonardo; Garin De Nardo, Daniel; Moreira, Constanza; Otheguy Vega, Marcos Javier; Pardiñas, Yeru; Passada, Ivonne; Payssé, Daniela; Pintado, Enrique; Xavier, Mónica"
421,140668,2018-08-01,RESOLUCION,1º MAYO 1983. TRABAJADORES ORGANIZADOS. ACTO PALACIO LEGISLATIVO. PLACA CONMEMORATIVA. COLOCACIÓN.,Asamblea General  ,"Ayala, Patricia; Carrera Leal, Charles; Castillo, Juan; De León, Leonardo; Garin De Nardo, Daniel; Martínez Huelmo, Rubén; Michelini, Rafael; Payssé, Daniela; Pintado, Enrique; Tourné, Daisy; Xavier, Mónica"
422,140424,2018-07-10,LEY,PALACIO LEGISLATIVO. INAUGURACIÓN. CENTENARIO. INTERÉS NACIONAL. DECLARACIÓN.,Cámara Senadores  ,"Asiaín, Carmen; Bordaberry Herrán, Juan Pedro; Camy Antognazza, Carlos Daniel; Carrera Leal, Charles; Castillo, Juan; Coutinho Rodríguez, Germán; De León, Leonardo; Delgado, Alvaro; García, Javier; Garín, Fernando; Larrañaga, Jorge; Mieres, Pablo; Moreira, Constanza; Otheguy Vega, Marcos Javier; Passada, Ivonne; Payssé, Daniela; Pintado, Enrique; Saravia, Jorge; Silveira, Julio C.; Tourné, Daisy; Xavier, Mónica"
423,140161,2018-06-18,LEY,TRABAJADOR DEPÓSITOS PORTUARIOS O EXTRAPORTUARIOS Y MUELLES O EXPLANADAS. JORNALES MÍNIMOS. FIJACIÓN. ENTRADA EN VIGENCIA. PRÓRROGA.,Cámara Senadores  ,"Camy Antognazza, Carlos Daniel; Castillo, Juan; Mieres, Pablo; Otheguy Vega, Marcos Javier; Passada, Ivonne"
424,139576,2018-05-08,MINUTA DE COMUNICACION,FUNDACION PROMOCION PERROS ASISTENCIA (FUNDAPPAS). SORTEOS ESPECIALES DIRECCION NACIONAL LOTERIAS Y QUINIELAS. ASIGNACION INGRESO ECONOMICO. SOLICITUD.,Cámara Senadores  ,"Ayala, Patricia; Carrera Leal, Charles; Castillo, Juan; Garin De Nardo, Daniel; Martínez Huelmo, Rubén; Otheguy Vega, Marcos Javier; Passada, Ivonne; Payssé, Daniela; Tourné, Daisy"
425,139480,2018-05-02,PROYECTO DE LEY,DÍA DEL ABOGADO EN URUGUAY - 9 DE MAYO. DECLARACIÓN.,Cámara Senadores  ,"Ayala, Patricia; Carballo Da Costa, Felipe; Carrera Leal, Charles; Castillo, Juan; Garin De Nardo, Daniel; Martínez Huelmo, Rubén; Moreira, Constanza; Otheguy Vega, Marcos Javier; Passada, Ivonne; Pintado, Enrique; Tourné, Daisy; Xavier, Mónica"
426,139089,2018-04-03,PROYECTO DE LEY,CÓDIGO DE LA NIÑEZ Y LA ADOLESCENCIA. CAPÍTULO XI. MODIFICACIÓN.,Cámara Senadores  ,"Carrera Leal, Charles; Castillo, Juan; De León, Leonardo; Garin De Nardo, Daniel; Moreira, Constanza; Otheguy Vega, Marcos Javier; Passada, Ivonne; Payssé, Daniela; Pintado, Enrique; Tourné, Daisy; Xavier, Mónica"
427,138643,2018-03-06,MINUTA DE COMUNICACION,PRINCIPIO IGUALDAD. MUJERES-HOMBRES. SALARIO. PROMOCION.,Cámara Senadores  ,"Ayala, Patricia; Carrera Leal, Charles; Castillo, Juan; De León, Leonardo; Martínez Huelmo, Rubén; Michelini, Rafael; Moreira, Constanza; Otheguy Vega, Marcos Javier; Passada, Ivonne; Payssé, Daniela; Pintado, Enrique; Tourné, Daisy; Xavier, Mónica"
428,124397,2015-05-05,PROYECTO DE LEY,INCAPACIDAD FUTURA. PREVISION. CURADOR. NOMBRAMIENTO.,Cámara Senadores  ,"Cersósimo, Gustavo"
429,140424,2018-07-10,LEY,PALACIO LEGISLATIVO. INAUGURACIÓN. CENTENARIO. INTERÉS NACIONAL. DECLARACIÓN.,Cámara Senadores  ,"Asiaín, Carmen; Bordaberry Herrán, Juan Pedro; Camy Antognazza, Carlos Daniel; Carrera Leal, Charles; Castillo, Juan; Coutinho Rodríguez, Germán; De León, Leonardo; Delgado, Alvaro; García, Javier; Garín, Fernando; Larrañaga, Jorge; Mieres, Pablo; Moreira, Constanza; Otheguy Vega, Marcos Javier; Passada, Ivonne; Payssé, Daniela; Pintado, Enrique; Saravia, Jorge; Silveira, Julio C.; Tourné, Daisy; Xavier, Mónica"
430,140425,2018-07-10,PROYECTO DE LEY,"INSTITUCIONES TRATO DIRECTO CON NIÑAS, NIÑOS, ADOLESCENTES, DISCAPACITADOS Y PERSONAS MAYORES DEPENDIENTES. MEDIDAS PREVENTIVAS.",Cámara Senadores  ,"Ayala, Patricia; Camy Antognazza, Carlos Daniel; Carrera Leal, Charles; Coutinho Rodríguez, Germán; Mieres, Pablo; Moreira, Constanza; Payssé, Daniela; Silveira, Julio C."
431,139681,2018-05-11,PROYECTO DE LEY,ACTORES POLITICOS. USO IMAGEN Y/O VOZ EN PIEZAS PUBLICITARIAS. REGULACION.,Cámara Senadores  ,"Coutinho Rodríguez, Germán"
432,137770,2017-12-05,PROYECTO DE LEY,DÍA DEL TÉCNICO EN HEMOTERAPIA O TRANSFUSIONISTA - 26 DE OCTUBRE. DECLARACIÓN.,Cámara Senadores  ,"Coutinho Rodríguez, Germán"
433,137375,2017-11-07,LEY,INGENIERO ELADIO DIESTE SAN MARTÍN. CONMEMORACIÓN CENTENARIO NACIMIENTO. INTERÉS NACIONAL. DECLARACIÓN.,Cámara Senadores  ,"Alonso, Verónica; Amorín, José; Ayala, Patricia; Bordaberry Herrán, Juan Pedro; Carámbula Volpi, Marcos Gustavo; Carrera Leal, Charles; Coutinho Rodríguez, Germán; De León, Leonardo; Delgado, Alvaro; Garin De Nardo, Daniel; Heber, Luis Alberto; Martínez Huelmo, Rubén; Michelini, Rafael; Mieres, Pablo; Moreira, Constanza; Mujica, José; Otheguy Vega, Marcos Javier; Passada, Ivonne; Payssé, Daniela; Pintado, Enrique; Tourné, Daisy; Xavier, Mónica"
434,136210,2017-08-09,DECLARACION,CAMBIO CLIMÁTICO. CONVENCIÓN MARCO NACIONES UNIDAS. COMPROMISO. DECLARACIÓN.,Cámara Senadores  ,"Amorín, José; Aviaga Martínez, María Carol; Besozzi, Guillermo; Bianchi, Daniel; Bordaberry Herrán, Juan Pedro; Camy Antognazza, Carlos Daniel; Cardozo Rufo, Virginia; Coutinho Rodríguez, Germán; De León, Leonardo; Delgado, Alvaro; García, Javier; Garin De Nardo, Daniel; Heber, Luis Alberto; Lacalle Pou, Luis Alberto; Larrañaga, Jorge; Mieres, Pablo"
435,130405,2016-06-22,PROYECTO DE LEY,CONDENADOS REINCIDENTES. SEGURIDAD PREVENTIVA. MEDIDAS. APLICACIÓN.,Cámara Senadores  ,"Coutinho Rodríguez, Germán"
436,130529,2016-05-24,RESOLUCION,PRESIDENTE REPUBLICA. MENSAJE ANUAL. SITUACION PAIS. SESION EXTRAORDINARIA. REALIZACION.,Cámara Senadores  ,"Amorín, José; Bianchi, Daniel; Bordaberry Herrán, Juan Pedro; Coutinho Rodríguez, Germán; Delgado, Alvaro; Mieres, Pablo"
437,128759,2016-03-16,PROYECTO DE RESOLUCION   ,"MONTANER, MARTHA. FALLECIMIENTO. HOMENAJE.",Asamblea General  ,"Amado, Fernando; Amorín, José; Bianchi, Daniel; Bordaberry Herrán, Juan Pedro; Coutinho Rodríguez, Germán; Eguiluz, Cecilia; Leal Alvarez, Auber Agapito; Matiaude, Graciela; Mieres, Pablo; Osta, Gustavo; Pasquet Iribarne, Ope; Verri, Walter"
438,128594,2016-03-08,DECLARACION,"CÁCERES, Berta. ORGANIZACIONES POPULARES E INDÍGENAS HONDURAS. PRESIDENTA. ASESINATO. JUSTICIA. RECLAMO. DECLARACIÓN.",Cámara Senadores  ,"Agazzi, Ernesto; Alonso, Verónica; Aviaga Martínez, María Carol; Ayala, Patricia; Berterreche, Andrés; Bianchi, Daniel; Bordaberry Herrán, Juan Pedro; Camy Antognazza, Carlos Daniel; Coutinho Rodríguez, Germán; Delgado, Alvaro; García, Javier; Heber, Luis Alberto; Lacalle Pou, Luis Alberto; Lafluf, Omar; Larrañaga, Jorge; Martínez Huelmo, Rubén; Michelini, Rafael; Mieres, Pablo; Passada, Ivonne; Saravia, Jorge; Topolansky, Lucía"
439,128447,2016-03-02,PROYECTO DE RESOLUCION   ,"PALME, Olof. TRAYECTORIA. HOMENAJE.",Cámara Senadores  ,"Amorín, José; Bordaberry Herrán, Juan Pedro; Coutinho Rodríguez, Germán; Delgado, Alvaro; Ramos, Conrado; Tourné, Daisy"
440,127929,2015-12-15,PROYECTO DE RESOLUCION,DECLARACIONES JOSE MUJICA CAMPAÑA ELECTORAL. INCONSTITUCIONALIDAD. CORTE ELECTORAL. CONSIDERACION. SOLICITUD.,Cámara Senadores  ,"Asiaín, Carmen; Besozzi, Guillermo; Bianchi, Daniel; Bordaberry Herrán, Juan Pedro; Camy Antognazza, Carlos Daniel; Castaingdebat, Armando; Coutinho Rodríguez, Germán; Delgado, Alvaro; García, Javier; Heber, Luis Alberto; López Villalba, Daniel; Piñeyrúa Olmos, Ana Lía; Saravia, Jorge"
