,id_ficha,fecha_entrada,tipo,titulo,origen,presentado_por
1045,125290,2015-07-01,PROYECTO DE LEY,INMUEBLES RURALES. DERECHO PROPIEDAD. TITULARIDAD. MODIFICACIÓN.,Cámara Senadores  ,"Agazzi, Ernesto; Ayala, Patricia; Berterreche, Andrés; Carámbula Volpi, Marcos Gustavo; De León, Leonardo; Gallicchio Queirolo, Antonio; Lazo, Sandra; Martínez Huelmo, Rubén; Moreira, Constanza; Otheguy Vega, Marcos Javier; Pardiñas, Yeru; Passada, Ivonne; Payssé, Daniela; Pintado, Enrique; Topolansky, Lucía; Xavier, Mónica"
1046,125291,2015-07-01,LEY,PUERTO JOSE CARBAJAL EL SABALERO. PUERTO SAUCE (COLONIA). DENOMINACION. MODIFICACION.,Cámara Senadores  ,"Agazzi, Ernesto; Ayala, Patricia; Berterreche, Andrés; Carámbula Volpi, Marcos Gustavo; De León, Leonardo; Gallicchio Queirolo, Antonio; Lazo, Sandra; Martínez Huelmo, Rubén; Moreira, Constanza; Otheguy Vega, Marcos Javier; Pardiñas, Yeru; Passada, Ivonne; Payssé, Daniela; Pintado, Enrique; Topolansky, Lucía; Xavier, Mónica"
1047,136681,2017-09-13,MINUTA DE COMUNICACION,MORTANDAD ABEJAS. MECANISMOS LEGALES. INSTRUMENTACION.,Cámara Representantes  ,"Castaingdebat, Armando; Delsa, Paulino; Eguiluz, Cecilia; Fratti, Luis Alfredo; Larzábal, Nelson; Minetti, Orquídea; Mujica, Gonzalo; Mutti Fornaroli, María Manuela; Posada, Iván; Roselli, Edmundo; Rubio, Eduardo; Ruiz, Juan Federico; Umpiérrez, Alejo; Varela Nestier, Carlos"
1048,136617,2017-09-12,PROYECTO DE LEY,AFILIADOS REGIMEN PREVISIONAL MIXTO. DESAFILIACION AFAP. HABILITACION. REGIMEN.,Cámara Representantes  ,"Mujica, Gonzalo"
1049,135389,2017-06-22,PROYECTO DE LEY,SALARIOS Y PASIVIDADES. IRPF. MINIMO INTANGIBLE Y PRIORIDAD DESCUENTOS. MODIFICACION.,Cámara Representantes  ,"Gandini, Jorge; Irazábal Calleri, Benjamín Eduardo; Mujica, Gonzalo; Penadés, Gustavo; Posada, Iván; Rodríguez, Conrado"
1050,127268,2015-11-10,PROYECTO DE LEY,INSTITUCIÓN NACIONAL DERECHOS HUMANOS . CREACIÓN. MODIFICACIÓN.,Cámara Senadores  ,"Agazzi, Ernesto; Ayala, Patricia; Berterreche, Andrés; Carámbula Volpi, Marcos Gustavo; De León, Leonardo; Ferreira, Zulimar; Martínez Huelmo, Rubén; Meléndez, Lauro; Michelini, Rafael; Moreira, Constanza; Mujica, Gonzalo; Otheguy Vega, Marcos Javier; Payssé, Daniela; Pintado, Enrique; Tourné, Daisy; Xavier, Mónica"
1051,140782,2018-08-14,RESOLUCION,"MUJICA, José. SENADOR REPUBLICA. RENUNCIA.",Cámara Senadores  ,"Mujica, José"
1052,138859,2018-03-13,PROYECTO DE LEY,DELITOS. VÍCTIMAS Y TESTIGOS. ATENCIÓN Y PROTECCIÓN. INTERÉS GENERAL. DECLARACIÓN.,Cámara Senadores  ,"Carrera Leal, Charles; De León, Leonardo; Garin De Nardo, Daniel; Michelini, Rafael; Mujica, José; Otheguy Vega, Marcos Javier; Payssé, Daniela; Pintado, Enrique; Tourné, Daisy; Xavier, Mónica"
1053,138863,2018-03-13,PROYECTO DE LEY,ACCIÓN DE NULIDAD ANTE EL TCA. REFORMAS PROCESALES.,Cámara Senadores  ,"Carrera Leal, Charles; De León, Leonardo; Garin De Nardo, Daniel; Michelini, Rafael; Mujica, José; Otheguy Vega, Marcos Javier; Passada, Ivonne; Payssé, Daniela; Pintado, Enrique; Tourné, Daisy; Xavier, Mónica"
1054,138864,2018-03-13,PROYECTO DE LEY,JUDICATURA Y ORGANIZACIÓN TRIBUNALES. LEY ORGÁNICA. MODIFICACIÓN.,Cámara Senadores  ,"Carrera Leal, Charles; De León, Leonardo; Garin De Nardo, Daniel; Michelini, Rafael; Mujica, José; Otheguy Vega, Marcos Javier; Passada, Ivonne; Payssé, Daniela; Pintado, Enrique; Tourné, Daisy; Xavier, Mónica"
1055,137830,2017-12-06,LEY,ENSEÑANZA. ELECCIONES UNIVERSITARIAS. MODIFICACIÓN.,Cámara Senadores  ,"Alonso, Verónica; Amorín, José; Ayala, Patricia; Besozzi, Guillermo; Bordaberry Herrán, Juan Pedro; Camy Antognazza, Carlos Daniel; Carámbula Volpi, Marcos Gustavo; Cardoso, José Carlos; Carrera Leal, Charles; Da Silva, Sebastián; De León, Leonardo; Delgado, Alvaro; Garin De Nardo, Daniel; Heber, Luis Alberto; Larrañaga, Jorge; Martínez Huelmo, Rubén; Michelini, Rafael; Moreira, Constanza; Mujica, José; Otheguy Vega, Marcos Javier; Passada, Ivonne; Payssé, Daniela; Pintado, Enrique; Saravia, Jorge; Tourné, Daisy; Xavier, Mónica"
1056,137427,2017-11-08,MINUTA DE COMUNICACION,MILAGRO ANDES. HOMENAJE. MONTEVIDEO. ESPACIO PUBLICO. SOLICITUD.,Cámara Senadores  ,"Bordaberry Herrán, Juan Pedro; Delgado, Alvaro; Mieres, Pablo; Mujica, José; Tourné, Daisy"
1057,137375,2017-11-07,LEY,INGENIERO ELADIO DIESTE SAN MARTÍN. CONMEMORACIÓN CENTENARIO NACIMIENTO. INTERÉS NACIONAL. DECLARACIÓN.,Cámara Senadores  ,"Alonso, Verónica; Amorín, José; Ayala, Patricia; Bordaberry Herrán, Juan Pedro; Carámbula Volpi, Marcos Gustavo; Carrera Leal, Charles; Coutinho Rodríguez, Germán; De León, Leonardo; Delgado, Alvaro; Garin De Nardo, Daniel; Heber, Luis Alberto; Martínez Huelmo, Rubén; Michelini, Rafael; Mieres, Pablo; Moreira, Constanza; Mujica, José; Otheguy Vega, Marcos Javier; Passada, Ivonne; Payssé, Daniela; Pintado, Enrique; Tourné, Daisy; Xavier, Mónica"
1058,137127,2017-10-17,MINUTA DE COMUNICACION,PARTIDOS POLITICOS. FUNCIONAMIENTO. FINANCIACION. NORMAS. REGULACION. MINUTA COMUNICACION,Cámara Senadores  ,"Mujica, José; Otheguy Vega, Marcos Javier; Pintado, Enrique; Xavier, Mónica"
1059,137051,2017-10-10,PROYECTO DE LEY,BANCA. TITULARIDAD. ELECCIONES NACIONALES.,Cámara Senadores  ,"Aristimuño, Saúl; Ayala, Patricia; Carrera Leal, Charles; García, Graciela; Garin De Nardo, Daniel; Michelini, Rafael; Moreira, Constanza; Mujica, José; Otheguy Vega, Marcos Javier; Payssé, Daniela; Pintado, Enrique; Suárez Bertora, Michelle; Xavier, Mónica"
1060,134850,2017-05-16,LEY,"LAUSAROT GUIGOU, Libertad Grizelda. LICEO Nº 1 CIUDAD DEL PLATA (SAN JOSE). DENOMINACION.",Cámara Senadores  ,"Ayala, Patricia; Carámbula Volpi, Marcos Gustavo; De León, Leonardo; Garin De Nardo, Daniel; Martínez Huelmo, Rubén; Michelini, Rafael; Moreira, Constanza; Mujica, José; Otheguy Vega, Marcos Javier; Passada, Ivonne; Payssé, Daniela; Pintado, Enrique; Topolansky, Lucía; Tourné, Daisy; Xavier, Mónica"
1061,134776,2017-05-10,PROYECTO DE LEY,SISTEMA MEDIOS PAGOS ELECTRONICOS. REGULACION.,Cámara Senadores  ,"Ayala, Patricia; De León, Leonardo; Garin De Nardo, Daniel; Lorier, Eduardo; Martínez Huelmo, Rubén; Moreira, Constanza; Mujica, José; Otheguy Vega, Marcos Javier; Passada, Ivonne; Topolansky, Lucía"
1062,132114,2016-10-18,LEY,"TOSCANINI, JUAN. TRAMO RUTA 69 (DESDE INTERSECCION CON RUTAS 67 Y 68 HASTA INTERSECCION CON RUTA 32). DENOMINACION.",Cámara Senadores  ,"Agazzi, Ernesto; Ayala, Patricia; Carámbula Volpi, Marcos Gustavo; De León, Leonardo; Ferreira, Zulimar; Lazo, Sandra; Martínez Huelmo, Rubén; Michelini, Rafael; Moreira, Constanza; Mujica, José; Otheguy Vega, Marcos Javier; Payssé, Daniela; Pintado, Enrique; Tourné, Daisy; Xavier, Mónica"
1063,132117,2016-10-18,LEY,INGENIERO RICARDO ROSA. TRAMO RUTA 67 (DESDE ELIAS REGULES HASTA SAUCE). DENOMINACION.,Cámara Senadores  ,"Agazzi, Ernesto; Ayala, Patricia; Carámbula Volpi, Marcos Gustavo; De León, Leonardo; Ferreira, Zulimar; Lazo, Sandra; Martínez Huelmo, Rubén; Michelini, Rafael; Moreira, Constanza; Mujica, José; Otheguy Vega, Marcos Javier; Payssé, Daniela; Pintado, Enrique; Tourné, Daisy; Xavier, Mónica"
1064,131029,2016-08-03,LEY,PRODUCCION BASES AGROECOLOGICAS. INTERES GENERAL. DECLARACION. COMISION HONORARIA NACIONAL. CREACION.,Cámara Senadores  ,"Agazzi, Ernesto; Aristimuño, Saúl; Ayala, Patricia; Carámbula Volpi, Marcos Gustavo; De León, Leonardo; Martínez Huelmo, Rubén; Michelini, Rafael; Mujica, José; Passada, Ivonne; Payssé, Daniela; Pintado, Enrique; Topolansky, Lucía; Xavier, Mónica"
1065,130766,2016-07-13,PROYECTO DE LEY,CODIGO CIVIL. MATRIMONIO. EDAD MÍNIMA. MODIFICACION.,Cámara Senadores  ,"Agazzi, Ernesto; Aristimuño, Saúl; Ayala, Patricia; De León, Leonardo; Gallicchio Queirolo, Antonio; Gomori Rettich, Eva Cristina; Lorier, Eduardo; Martínez Huelmo, Rubén; Mujica, José; Pardiñas, Yeru; Passada, Ivonne; Paternain Rodríguez, Rafael; Pintado, Enrique; Pintos Ruiz, Julio Miguel; Topolansky, Lucía"
1066,130280,2016-06-15,PROYECTO DE LEY,"VILLALBA, Olegario. ESCUELA RURAL N° 97 VILLA SERRANA (LAVALLEJA). DENOMINACIÓN.",Cámara Senadores  ,"Agazzi, Ernesto; Ayala, Patricia; Baráibar, Carlos; Carámbula Volpi, Marcos Gustavo; De León, Leonardo; Lazo, Sandra; Martínez Huelmo, Rubén; Michelini, Rafael; Moreira, Constanza; Mujica, José; Otheguy Vega, Marcos Javier; Passada, Ivonne; Payssé, Daniela; Topolansky, Lucía; Tourné, Daisy; Xavier, Mónica"
1067,129710,2016-05-17,PROYECTO DE RESOLUCION   ,"MICHELINI, Zelmar, GUTIERREZ RUIZ, Héctor. EX LEGISLADORES. HOMENAJE.",Asamblea General  ,"Amorín, José; Chiazzaro, Roberto; De León, Leonardo; De los Santos, Oscar; Delgado, Alvaro; Gandini, Jorge; González, Pablo; Heber, Luis Alberto; Mahía, José Carlos; Meroni, Jorge; Minetti, Orquídea; Mujica, José; Pasquet Iribarne, Ope; Payssé, Daniela; Posada, Iván; Querejeta, José; Rubio, Eduardo"
1068,125462,2015-07-14,PROYECTO DE RESOLUCION   ,"SINGLET, Manuel. FALLECIMIENTO. HOMENAJE.",Cámara Senadores  ,"Agazzi, Ernesto; Alonso, Verónica; Camy Antognazza, Carlos Daniel; Coutinho Rodríguez, Germán; Delgado, Alvaro; Eguiluz, Cecilia; García, Javier; Lacalle Pou, Luis Alberto; Larrañaga, Jorge; Martínez Huelmo, Rubén; Mieres, Pablo; Montaner, Martha; Mujica, José; Topolansky, Lucía; Tourné, Daisy; Xavier, Mónica"
1069,125014,2015-06-16,LEY,"FRUTAS, FLORES Y HORTALIZAS. IVA. FONDO RECONSTRUCCION Y FOMENTO DE LA GRANJA. FINANCIACION. PRORROGA.",Cámara Senadores  ,"Agazzi, Ernesto; Amorín, José; Ayala, Patricia; De León, Leonardo; Martínez Huelmo, Rubén; Michelini, Rafael; Mujica, José; Pardiñas, Yeru"
1070,125018,2015-06-16,LEY,NACIONALIDAD URUGUAYA. MODIFICACIÓN.,Cámara Senadores  ,"Agazzi, Ernesto; Ayala, Patricia; De León, Leonardo; Martínez Huelmo, Rubén; Meléndez, Lauro; Michelini, Rafael; Mujica, José; Otheguy Vega, Marcos Javier; Pardiñas, Yeru; Passada, Ivonne; Paternain Rodríguez, Rafael; Payssé, Daniela; Pintado, Enrique; Topolansky, Lucía; Xavier, Mónica"
1071,124969,2015-06-10,PROYECTO DE RESOLUCION   ,"MASSERA, José Luis. NACIMIENTO (100 AÑOS). CONMEMORACION. HOMENAJE.",Asamblea General  ,"Agazzi, Ernesto; Berterreche, Andrés; Bianchi, Daniel; Carámbula Volpi, Marcos Gustavo; Carballo Da Costa, Felipe; Castaingdebat, Armando; De León, Leonardo; Gelman, Macarena; Groba Arriondo, Oscar; Mahía, José Carlos; Martínez Huelmo, Rubén; Moreira, Constanza; Mujica, José; Pardiñas, Yeru; Passada, Ivonne; Payssé, Daniela; Pereyra, Susana; Pintado, Enrique; Pozzi, Jorge; Puig, Luis; Radío, Daniel; Sánchez, Alejandro; Topolansky, Lucía; Verri, Walter; Xavier, Mónica"
1072,143084,2019-04-02,PROYECTO DE MINUTA DE COMUNICACION,BUSTO PROCER JOSE ARTIGAS. UNIVERSIDAD ESTATAL SAN PETERSBURGO. DONACION.,Cámara Senadores  ,"Ayala, Patricia; Baráibar, Carlos; Berterreche, Andrés; Castillo, Juan; Michelini, Rafael; Moreira, Constanza; Otheguy Vega, Marcos Javier"
1073,142063,2018-12-05,PROYECTO DE LEY,LICENCIADO EN NUTRICIÓN. PROFESIÓN UNIVERSITARIA. REGULACIÓN MARCO JURÍDICO.,Cámara Senadores  ,"Aristimuño, Saúl; Ayala, Patricia; Baráibar, Carlos; Besozzi, Guillermo; Bordaberry Herrán, Juan Pedro; Carrera Leal, Charles; Castillo, Juan; Delgado, Alvaro; García, Javier; Garin De Nardo, Daniel; Gomori Rettich, Eva Cristina; Michelini, Rafael; Mieres, Pablo; Moreira, Constanza; Otheguy Vega, Marcos Javier; Pardiñas, Yeru; Passada, Ivonne; Xavier, Mónica"
1074,141848,2018-11-14,PROYECTO DE LEY,"TERRA, Gabriel. REPRESA. DENOMINACIÓN. MODIFICACIÓN.",Cámara Senadores  ,"Aristimuño, Saúl; Ayala, Patricia; Berterreche, Andrés; Carrera Leal, Charles; Castillo, Juan; Garin De Nardo, Daniel; Martínez Huelmo, Rubén; Michelini, Rafael; Moreira, Constanza; Otheguy Vega, Marcos Javier; Passada, Ivonne; Payssé, Daniela; Pintado, Enrique; Tourné, Daisy; Xavier, Mónica"
1075,141494,2018-10-09,PROYECTO DE LEY,EJERCICIO FUNCIÓN PÚBLICA. BUENAS PRÁCTICAS. ADECUACIÓN. INTERÉS GENERAL. DECLARACIÓN.,Cámara Senadores  ,"Ayala, Patricia; Berterreche, Andrés; Carrera Leal, Charles; Castillo, Juan; De León, Leonardo; Garin De Nardo, Daniel; Moreira, Constanza; Otheguy Vega, Marcos Javier; Pardiñas, Yeru; Passada, Ivonne; Payssé, Daniela; Pintado, Enrique; Xavier, Mónica"
1076,140544,2018-07-17,PROYECTO DE DECLARACION,NICARAGUA. ACTOS VIOLACION DERECHOS HUMANOS Y LIBERTADES FUNDAMENTALES. CONDENA. DECLARACION,Cámara Senadores  ,"De León, Leonardo; Martínez Huelmo, Rubén; Michelini, Rafael; Otheguy Vega, Marcos Javier; Payssé, Daniela; Pintado, Enrique; Tourné, Daisy"
1077,140424,2018-07-10,LEY,PALACIO LEGISLATIVO. INAUGURACIÓN. CENTENARIO. INTERÉS NACIONAL. DECLARACIÓN.,Cámara Senadores  ,"Asiaín, Carmen; Bordaberry Herrán, Juan Pedro; Camy Antognazza, Carlos Daniel; Carrera Leal, Charles; Castillo, Juan; Coutinho Rodríguez, Germán; De León, Leonardo; Delgado, Alvaro; García, Javier; Garín, Fernando; Larrañaga, Jorge; Mieres, Pablo; Moreira, Constanza; Otheguy Vega, Marcos Javier; Passada, Ivonne; Payssé, Daniela; Pintado, Enrique; Saravia, Jorge; Silveira, Julio C.; Tourné, Daisy; Xavier, Mónica"
1078,140161,2018-06-18,LEY,TRABAJADOR DEPÓSITOS PORTUARIOS O EXTRAPORTUARIOS Y MUELLES O EXPLANADAS. JORNALES MÍNIMOS. FIJACIÓN. ENTRADA EN VIGENCIA. PRÓRROGA.,Cámara Senadores  ,"Camy Antognazza, Carlos Daniel; Castillo, Juan; Mieres, Pablo; Otheguy Vega, Marcos Javier; Passada, Ivonne"
1079,139576,2018-05-08,MINUTA DE COMUNICACION,FUNDACION PROMOCION PERROS ASISTENCIA (FUNDAPPAS). SORTEOS ESPECIALES DIRECCION NACIONAL LOTERIAS Y QUINIELAS. ASIGNACION INGRESO ECONOMICO. SOLICITUD.,Cámara Senadores  ,"Ayala, Patricia; Carrera Leal, Charles; Castillo, Juan; Garin De Nardo, Daniel; Martínez Huelmo, Rubén; Otheguy Vega, Marcos Javier; Passada, Ivonne; Payssé, Daniela; Tourné, Daisy"
1080,139480,2018-05-02,PROYECTO DE LEY,DÍA DEL ABOGADO EN URUGUAY - 9 DE MAYO. DECLARACIÓN.,Cámara Senadores  ,"Ayala, Patricia; Carballo Da Costa, Felipe; Carrera Leal, Charles; Castillo, Juan; Garin De Nardo, Daniel; Martínez Huelmo, Rubén; Moreira, Constanza; Otheguy Vega, Marcos Javier; Passada, Ivonne; Pintado, Enrique; Tourné, Daisy; Xavier, Mónica"
1081,139089,2018-04-03,PROYECTO DE LEY,CÓDIGO DE LA NIÑEZ Y LA ADOLESCENCIA. CAPÍTULO XI. MODIFICACIÓN.,Cámara Senadores  ,"Carrera Leal, Charles; Castillo, Juan; De León, Leonardo; Garin De Nardo, Daniel; Moreira, Constanza; Otheguy Vega, Marcos Javier; Passada, Ivonne; Payssé, Daniela; Pintado, Enrique; Tourné, Daisy; Xavier, Mónica"
1082,138859,2018-03-13,PROYECTO DE LEY,DELITOS. VÍCTIMAS Y TESTIGOS. ATENCIÓN Y PROTECCIÓN. INTERÉS GENERAL. DECLARACIÓN.,Cámara Senadores  ,"Carrera Leal, Charles; De León, Leonardo; Garin De Nardo, Daniel; Michelini, Rafael; Mujica, José; Otheguy Vega, Marcos Javier; Payssé, Daniela; Pintado, Enrique; Tourné, Daisy; Xavier, Mónica"
1083,138863,2018-03-13,PROYECTO DE LEY,ACCIÓN DE NULIDAD ANTE EL TCA. REFORMAS PROCESALES.,Cámara Senadores  ,"Carrera Leal, Charles; De León, Leonardo; Garin De Nardo, Daniel; Michelini, Rafael; Mujica, José; Otheguy Vega, Marcos Javier; Passada, Ivonne; Payssé, Daniela; Pintado, Enrique; Tourné, Daisy; Xavier, Mónica"
1084,138864,2018-03-13,PROYECTO DE LEY,JUDICATURA Y ORGANIZACIÓN TRIBUNALES. LEY ORGÁNICA. MODIFICACIÓN.,Cámara Senadores  ,"Carrera Leal, Charles; De León, Leonardo; Garin De Nardo, Daniel; Michelini, Rafael; Mujica, José; Otheguy Vega, Marcos Javier; Passada, Ivonne; Payssé, Daniela; Pintado, Enrique; Tourné, Daisy; Xavier, Mónica"
1085,138643,2018-03-06,MINUTA DE COMUNICACION,PRINCIPIO IGUALDAD. MUJERES-HOMBRES. SALARIO. PROMOCION.,Cámara Senadores  ,"Ayala, Patricia; Carrera Leal, Charles; Castillo, Juan; De León, Leonardo; Martínez Huelmo, Rubén; Michelini, Rafael; Moreira, Constanza; Otheguy Vega, Marcos Javier; Passada, Ivonne; Payssé, Daniela; Pintado, Enrique; Tourné, Daisy; Xavier, Mónica"
1086,137830,2017-12-06,LEY,ENSEÑANZA. ELECCIONES UNIVERSITARIAS. MODIFICACIÓN.,Cámara Senadores  ,"Alonso, Verónica; Amorín, José; Ayala, Patricia; Besozzi, Guillermo; Bordaberry Herrán, Juan Pedro; Camy Antognazza, Carlos Daniel; Carámbula Volpi, Marcos Gustavo; Cardoso, José Carlos; Carrera Leal, Charles; Da Silva, Sebastián; De León, Leonardo; Delgado, Alvaro; Garin De Nardo, Daniel; Heber, Luis Alberto; Larrañaga, Jorge; Martínez Huelmo, Rubén; Michelini, Rafael; Moreira, Constanza; Mujica, José; Otheguy Vega, Marcos Javier; Passada, Ivonne; Payssé, Daniela; Pintado, Enrique; Saravia, Jorge; Tourné, Daisy; Xavier, Mónica"
1087,137658,2017-11-22,LEY,CÓDIGO DEL PROCESO PENAL. LEY 19.293. MATERIA INFRACCIONAL ADOLESCENTE. INCORPORACIÓN.,Cámara Senadores  ,"Ayala, Patricia; Carrera Leal, Charles; De León, Leonardo; Garin De Nardo, Daniel; Lazo, Sandra; Martínez Huelmo, Rubén; Michelini, Rafael; Moreira, Constanza; Otheguy Vega, Marcos Javier; Payssé, Daniela; Suárez Bertora, Michelle; Xavier, Mónica"
1088,137606,2017-11-15,PROYECTO DE DECLARACION,IRAN. TERREMOTO. SOLIDARIDAD. DECLARACION.,Cámara Senadores  ,"Bordaberry Herrán, Juan Pedro; Camy Antognazza, Carlos Daniel; De León, Leonardo; Mieres, Pablo; Otheguy Vega, Marcos Javier; Saravia, Jorge"
1089,137519,2017-11-14,PROYECTO DE LEY,SEDES PODER JUDICIAL. SISTEMA DE REGISTRO DE AUDIENCIAS. FUNCIONAMIENTO.,Cámara Senadores  ,"Ayala, Patricia; Carrera Leal, Charles; De León, Leonardo; Garin De Nardo, Daniel; Martínez Huelmo, Rubén; Michelini, Rafael; Otheguy Vega, Marcos Javier; Passada, Ivonne; Payssé, Daniela; Tourné, Daisy; Xavier, Mónica"
1090,137375,2017-11-07,LEY,INGENIERO ELADIO DIESTE SAN MARTÍN. CONMEMORACIÓN CENTENARIO NACIMIENTO. INTERÉS NACIONAL. DECLARACIÓN.,Cámara Senadores  ,"Alonso, Verónica; Amorín, José; Ayala, Patricia; Bordaberry Herrán, Juan Pedro; Carámbula Volpi, Marcos Gustavo; Carrera Leal, Charles; Coutinho Rodríguez, Germán; De León, Leonardo; Delgado, Alvaro; Garin De Nardo, Daniel; Heber, Luis Alberto; Martínez Huelmo, Rubén; Michelini, Rafael; Mieres, Pablo; Moreira, Constanza; Mujica, José; Otheguy Vega, Marcos Javier; Passada, Ivonne; Payssé, Daniela; Pintado, Enrique; Tourné, Daisy; Xavier, Mónica"
1091,137300,2017-11-01,PROYECTO DE LEY,INSTITUCION DERECHOS HUMANOS (NACIONAL). LEY 18446. MODIFICACION,Cámara Senadores  ,"Ayala, Patricia; Carámbula Volpi, Marcos Gustavo; Carrera Leal, Charles; De León, Leonardo; Gallicchio Queirolo, Antonio; Garin De Nardo, Daniel; Moreira, Constanza; Otheguy Vega, Marcos Javier; Passada, Ivonne; Payssé, Daniela; Pintado, Enrique; Tourné, Daisy; Xavier, Mónica"
1092,137127,2017-10-17,MINUTA DE COMUNICACION,PARTIDOS POLITICOS. FUNCIONAMIENTO. FINANCIACION. NORMAS. REGULACION. MINUTA COMUNICACION,Cámara Senadores  ,"Mujica, José; Otheguy Vega, Marcos Javier; Pintado, Enrique; Xavier, Mónica"
1093,137048,2017-10-11,PROYECTO DE LEY,TESTIGOS Y DENUNCIANTES. RESERVA IDENTIDAD. INSPECCIÓN GENERAL TRABAJO Y SEGURIDAD SOCIAL.,Cámara Senadores  ,"Aristimuño, Saúl; Carrera Leal, Charles; Ferreira, Zulimar; García, Graciela; Garin De Nardo, Daniel; Michelini, Rafael; Otheguy Vega, Marcos Javier; Pintado, Enrique; Suárez Bertora, Michelle; Xavier, Mónica"
1094,137051,2017-10-10,PROYECTO DE LEY,BANCA. TITULARIDAD. ELECCIONES NACIONALES.,Cámara Senadores  ,"Aristimuño, Saúl; Ayala, Patricia; Carrera Leal, Charles; García, Graciela; Garin De Nardo, Daniel; Michelini, Rafael; Moreira, Constanza; Mujica, José; Otheguy Vega, Marcos Javier; Payssé, Daniela; Pintado, Enrique; Suárez Bertora, Michelle; Xavier, Mónica"
1095,135668,2017-07-12,PROYECTO DE LEY,LEY PARTIDOS POLÍTICOS. MODIFICACIÓN.,Cámara Senadores  ,"Ayala, Patricia; Berterreche, Andrés; Carámbula Volpi, Marcos Gustavo; De León, Leonardo; Gallicchio Queirolo, Antonio; Lazo, Sandra; Martínez Huelmo, Rubén; Moreira, Constanza; Otheguy Vega, Marcos Javier; Passada, Ivonne; Payssé, Daniela; Pintado, Enrique; Topolansky, Lucía; Tourné, Daisy; Xavier, Mónica"
1096,135482,2017-06-29,LEY,SITIOS MEMORIA HISTORICA DEL PASADO RECIENTE. INTERES GENERAL. DECLARACION.,Cámara Senadores  ,"Ayala, Patricia; Carámbula Volpi, Marcos Gustavo; Garin De Nardo, Daniel; Lazo, Sandra; Martínez Huelmo, Rubén; Michelini, Rafael; Moreira, Constanza; Otheguy Vega, Marcos Javier; Payssé, Daniela; Pintado, Enrique; Topolansky, Lucía; Xavier, Mónica"
1097,135165,2017-06-07,LEY,"GUERRA MATTOS, EVARISTO. RUTA 81. TRAMO ENTRE RUTA 7 Y RUTA 80 (CANELONES). DENOMINACION.",Cámara Senadores  ,"Ayala, Patricia; Berterreche, Andrés; Carámbula Volpi, Marcos Gustavo; Garin De Nardo, Daniel; Martínez Huelmo, Rubén; Michelini, Rafael; Moreira, Constanza; Otheguy Vega, Marcos Javier; Passada, Ivonne; Payssé, Daniela; Topolansky, Lucía; Xavier, Mónica"
1098,134850,2017-05-16,LEY,"LAUSAROT GUIGOU, Libertad Grizelda. LICEO Nº 1 CIUDAD DEL PLATA (SAN JOSE). DENOMINACION.",Cámara Senadores  ,"Ayala, Patricia; Carámbula Volpi, Marcos Gustavo; De León, Leonardo; Garin De Nardo, Daniel; Martínez Huelmo, Rubén; Michelini, Rafael; Moreira, Constanza; Mujica, José; Otheguy Vega, Marcos Javier; Passada, Ivonne; Payssé, Daniela; Pintado, Enrique; Topolansky, Lucía; Tourné, Daisy; Xavier, Mónica"
1099,134776,2017-05-10,PROYECTO DE LEY,SISTEMA MEDIOS PAGOS ELECTRONICOS. REGULACION.,Cámara Senadores  ,"Ayala, Patricia; De León, Leonardo; Garin De Nardo, Daniel; Lorier, Eduardo; Martínez Huelmo, Rubén; Moreira, Constanza; Mujica, José; Otheguy Vega, Marcos Javier; Passada, Ivonne; Topolansky, Lucía"
1100,134340,2017-04-05,PROYECTO DE LEY,CODIGO PENAL. ABUSO DE FUNCIONES. DEROGACION.,Cámara Senadores  ,"Ayala, Patricia; Besozzi, Guillermo; De León, Leonardo; Garin De Nardo, Daniel; Martínez Huelmo, Rubén; Michelini, Rafael; Otheguy Vega, Marcos Javier; Passada, Ivonne; Payssé, Daniela; Pintado, Enrique; Saravia, Jorge; Tourné, Daisy"
1101,133875,2017-03-14,LEY,DIA DE LA PRIMERA BANDERA DE JOSE ARTIGAS. DECLARACION.,Cámara Senadores  ,"Ayala, Patricia; De León, Leonardo; Garin De Nardo, Daniel; Lorier, Eduardo; Martínez Huelmo, Rubén; Michelini, Rafael; Otheguy Vega, Marcos Javier; Pardiñas, Yeru; Pintado, Enrique"
1102,133365,2016-12-28,MINUTA DE COMUNICACION,NORDEX S.A. SEGURO DESEMPLEO. EXTENSIÓN.,Cámara Senadores  ,"Michelini, Rafael; Otheguy Vega, Marcos Javier"
1103,132929,2016-11-30,LEY,RESPONSABILIDAD DECENAL. CODIGO CIVIL. MODIFICACION.,Cámara Senadores  ,"Ayala, Patricia; Berterreche, Andrés; Carámbula Volpi, Marcos Gustavo; De León, Leonardo; Ferreira, Zulimar; Garin De Nardo, Daniel; Laguarda, Manuel; Martínez Huelmo, Rubén; Michelini, Rafael; Moreira, Constanza; Otheguy Vega, Marcos Javier; Pardiñas, Yeru; Passada, Ivonne; Payssé, Daniela; Pintado, Enrique"
1104,132804,2016-11-22,PROYECTO DE LEY,ENTES AUTÓNOMOS. SERVICIOS DESCENTRALIZADOS. GIRO. MODIFICACIÓN.,Cámara Senadores  ,"Agazzi, Ernesto; Ayala, Patricia; Berterreche, Andrés; Carámbula Volpi, Marcos Gustavo; De León, Leonardo; Martínez Huelmo, Rubén; Michelini, Rafael; Moreira, Constanza; Otheguy Vega, Marcos Javier; Pardiñas, Yeru; Passada, Ivonne; Payssé, Daniela; Pintado, Enrique; Topolansky, Lucía; Xavier, Mónica"
1105,132114,2016-10-18,LEY,"TOSCANINI, JUAN. TRAMO RUTA 69 (DESDE INTERSECCION CON RUTAS 67 Y 68 HASTA INTERSECCION CON RUTA 32). DENOMINACION.",Cámara Senadores  ,"Agazzi, Ernesto; Ayala, Patricia; Carámbula Volpi, Marcos Gustavo; De León, Leonardo; Ferreira, Zulimar; Lazo, Sandra; Martínez Huelmo, Rubén; Michelini, Rafael; Moreira, Constanza; Mujica, José; Otheguy Vega, Marcos Javier; Payssé, Daniela; Pintado, Enrique; Tourné, Daisy; Xavier, Mónica"
1106,132117,2016-10-18,LEY,INGENIERO RICARDO ROSA. TRAMO RUTA 67 (DESDE ELIAS REGULES HASTA SAUCE). DENOMINACION.,Cámara Senadores  ,"Agazzi, Ernesto; Ayala, Patricia; Carámbula Volpi, Marcos Gustavo; De León, Leonardo; Ferreira, Zulimar; Lazo, Sandra; Martínez Huelmo, Rubén; Michelini, Rafael; Moreira, Constanza; Mujica, José; Otheguy Vega, Marcos Javier; Payssé, Daniela; Pintado, Enrique; Tourné, Daisy; Xavier, Mónica"
1107,131639,2016-09-13,LEY,GOBIERNOS DEPARTAMENTALES. FUNCIONARIOS. INGRESOS SALARIALES. TOPES. APLICACION.,Cámara Senadores  ,"Amorín, José; Bordaberry Herrán, Juan Pedro; Camy Antognazza, Carlos Daniel; Delgado, Alvaro; Heber, Luis Alberto; Michelini, Rafael; Mieres, Pablo; Otheguy Vega, Marcos Javier"
1108,130280,2016-06-15,PROYECTO DE LEY,"VILLALBA, Olegario. ESCUELA RURAL N° 97 VILLA SERRANA (LAVALLEJA). DENOMINACIÓN.",Cámara Senadores  ,"Agazzi, Ernesto; Ayala, Patricia; Baráibar, Carlos; Carámbula Volpi, Marcos Gustavo; De León, Leonardo; Lazo, Sandra; Martínez Huelmo, Rubén; Michelini, Rafael; Moreira, Constanza; Mujica, José; Otheguy Vega, Marcos Javier; Passada, Ivonne; Payssé, Daniela; Topolansky, Lucía; Tourné, Daisy; Xavier, Mónica"
1109,130145,2016-06-08,LEY,PARTIDOS POLITICOS. CARGOS. PARTICIPACION PARITARIA AMBOS SEXOS. PROMOCION.,Cámara Senadores  ,"Ayala, Patricia; Berterreche, Andrés; De León, Leonardo; Martínez Huelmo, Rubén; Michelini, Rafael; Otheguy Vega, Marcos Javier; Payssé, Daniela; Pintado, Enrique; Tourné, Daisy; Xavier, Mónica"
1110,128446,2016-03-02,LEY,MOSQUITO AEDES AEGYPTI. FUMIGACION PREDIOS BALDÍOS Y FINCAS ABANDONADAS. INGRESO. AUTORIZACIÓN.,Cámara Senadores  ,"Agazzi, Ernesto; Ayala, Patricia; Berterreche, Andrés; Carámbula Volpi, Marcos Gustavo; De León, Leonardo; Martínez Huelmo, Rubén; Michelini, Rafael; Moreira, Constanza; Otheguy Vega, Marcos Javier; Passada, Ivonne; Payssé, Daniela; Pintado, Enrique; Topolansky, Lucía; Tourné, Daisy"
